Date,Time,Town / Village,Area,"Occupation
(Where Relevant)",Description
1998-12-20,18:00,Warrington,Cheshire,,"Large bright triangle, grey on the perimeter. Three orange lights on each point. Travelled across the sky not particularly fast."
1998-12-20,23:15,Ventnor/Isle of Wight,Hampshire,,One diamond shaped object with red circles on it.
1998-12-20,03:00,Edinburgh,Lothian,,"A line of 3 or 4 lights, orange in colour."
1998-12-20,03:00,Edinburgh,Lothian,,"Gold coloured ball with a tail (like a comet), which was very bright."
1998-12-20,16:30,Knutsford,Cheshire,,"Oval, grey, single object - approx. 6ft. Was heading South."
1998-12-21,00:30,Tedburn St Mary,Devon,,One disc with a bright light.
1998-12-21,00:45,Edinburgh,Lothian,,"An object that was changing colour. Green lights/lasers. Stationary, hovered and the moved."
1998-12-22,19:00,Bradford,West Yorkshire,,Four large objects (each one was 3 times larger than a Hercules).
1998-12-22,20:44,Whitwell/Isle of Wight,Hampshire,,Boomerang shaped object. Flew over head very quickly and then disappeared.
1998-12-22,23:45,Newton Mearns/Glasgow,Lanarkshire,,"There were a series of lights, that were fast."
No Firm Date,,Farnborough,Kent,,"Objects that appeared from nowhere, flew erratically and were pilotless, sometimes accompanied by a bright flash. Seen everyday for the last three years."
1999-01-04,18:30,Folkestone,Kent,,Squashed oval shaped object. Did not have the usual aircraft lights on it.
1999-01-04,06:45,Bournemouth,Dorset,,"One disc shaped object, no indication of size. There were two bright, blue flashing lights on it."
1999-01-07,18:30,Glanarfon,Wales,,"One flat, triangular object, (like a shield), white in colour. Coloured lights mainly round the edge of the craft. Spotlight beneath."
1999-01-09,22:00,Bolton,Lancashire,,"One main object, blue, red and white."
1999-01-09,02:00,The Rhondda,Mid Glamorgan,,"One large oval, with a sphere in the middle. Had bright blue, green and white lights on top of the craft. There was a humming noise."
1999-01-09,01:20,Dukinfield,Cheshire,,"One or two round, star sized objects were seen. They were multi coloured."
1999-01-09,21:37,Dunbar,East Lothian,,"One light, with red, green and yellow alternating lights on it."
1999-01-09,21:46,Kennoway,Fife,,"One sphere, that was alternating in colours - red, white, green and blue."
1999-01-10,01:30,Llanelli,Dyfed,,"One object, a pinprick of light changing colour between red, green and orange."
1999-01-10,10:07,Hednesford,Staffordshire,,"Like a bright star, with red, green and blue lights flashing in it. Hovering silently."
1999-01-10,21:54,West Kilbride,Ayrshire,,Bright multi coloured light in the sky.
1999-01-11,01:30,Ballater,Aberdeenshire,,"Two objects, four times larger than the largest star and round like a glitter ball. They had blue, red and green lights on them."
1999-01-11,01:15,Holyhead,Merseyside,,"Bright light, larger than a star, changing colours, from white to orange, blue and green and back again. Appeared to be moving slowly."
1999-01-12,09:15,Cambuslong,Lanarkshire,,"Bright light, like a star."
1999-01-12,05:55,Shoreham-by-Sea,West Sussex,,"Two objects, oval shaped and bright white. Then later, another two objects that looked the same, appeared."
1999-01-17,06:20,Hanworth,Middlesex,,Flashes of light came through the bedroom window. A bright star-like object was then seen outside.
1999-01-21,20:45,Corwen,Denbighshire,,"Flying saucer shape, with three square like windows, like a house. Was light - got lighter, then dimmed. Slightly tilted."
1999-01-21,21:00,Harleston,London,,"One large, L - shaped object. Was very bright."
1999-01-22,00:30,Shrewsbury,Shropshire,,White light with shimmering green and red lights.
1999-01-26,,Henbury/Bristol,Somerset,,Bright orange light.
1999-01-28,,Shipston-on-Stour,Warwickshire,,"Looked like an aeroplane, (had wings, but no propellers). It was silent with red and blue lights on it. Was hovering above the tree tops."
1999-02-01,15:10,Bramley,West Yorkshire,,One object with grey/white tubular fins at both ends.
1999-02-02,17:25,Swansea,West Glamorgan,,Cross shaped collection of five star like objects. Gold coloured lights.
1999-02-02,18:00,North Finchley,London,,Two opaque spheres. The two objects were chasing each other around.
1999-02-02,01:30,Hull,Humberside,,"Round in shape. Coloured red, green, blue, white and yellow."
1999-02-04,00:20,M56 towards Chester,Cheshire,,"One, circular object, very dark with four permanent red lights and three to four pulsating lights."
1999-02-05,01:30,Brighton,East Sussex,,"One round object, with a very bright, white light. Was hovering like a yo-yo."
1999-02-05,,Chiswick,London,,"Five, six or seven unusual light objects. Moving in all different directions."
1999-02-06,22:45,Hadleigh,Suffolk,,Boomerang shaped craft. Red flashing light on the front and a white consistent light on each side. Was hovering.
1999-02-07,18:50,Brighton,East Sussex,,One diamond shaped object. Had white/blue colours on it. Was very bright. Was hovering and moved up and down too.
1999-02-07,18:20,Winchester,Hampshire,,One indistinct shaped object that was white and very bright.
1999-02-07,22:45,West Hampstead,London,,A silver ball of light. It darted around and was very fast.
1999-02-07,22:25,M53/Hopsford,Warwickshire,,"Circular object, the colour of a green traffic light. It moved in a steady, straight line."
1999-02-09,20:06,Wandsworth,London,,One object that was hovering.
1999-02-10,02:45,Swansea,West Glamorgan,Retired Air Traffic Controller,"A single blue and red object. Very bright. It made an S pattern in the sky, when finished, moved North East."
1999-02-11,18:45,Caernarvon,Gwynedd,,"Single aircraft/object, that had rotors. It had blue, red and white strobes."
1999-02-11,19:50,Near Ambury,Worcestershire,,One oval spot light.
1999-02-12,21:00,Wakefield,West Yorkshire,,"Single object, rectangular, like a fire ball, with a red centre and an orange or yellow aura."
1999-02-14,05:30,Hastings,E Sussex,,A UFO that looked like a helicopter? It hovered and then shot off into the distance. It had red flashing lights!
1999-02-14,23:00,Brook,Surrey,,Three or four lights linked by a green lattice.
1999-02-15,10:25,Prestwick,Ayrshire,,"Primary radar contact, ten miles wide. Object was travelling very quickly."
1999-02-15,07:50,Didlington,Norfolk,,"A 'Hub-cap on it's side' shape, which was a very bright orange/yellow colour."
1999-02-17,07:00,Canning Town,London,,"Two large objects that changed from a water drop shape, to a 'U' shape then separated into squiggly lines. Very bright orange/yellow colour."
1999-02-20,19:00,East Horsley,Surrey,,"Eight small circles forming one large circle, which was green in colour."
1999-02-20,07:20,Burt,Lancashire,,One exceedingly bright white light approximately 10 metres in diameter. Appeared to be disc shaped.
1999-02-21,18:45,Humber Bridge/Hull,East Yorkshire,,"The object looked like a dull orange ball, the size of a tennis ball. It made a jig movement."
1999-02-22,,Glasgow,Glasgow,,A silver ball was hovering for a few seconds and then shot off.
1999-02-22,20:20,Pickering,North Yorkshire,,"Two objects diagonally above one another, initially blue in colour, they disappeared for a few minutes and reappeared orange in colour."
1999-02-22,23:45,Halifax,West Yorkshire,,"One quite big, round shadowy object with bright lights. There was a droning sound."
1999-02-22,18:00,Birkenhead,Merseyside,,"Two lights in the sky, one bigger than the other."
1999-02-22,18:45,Ilkley,West Yorkshire,,"Two very large round, white objects. They were very bright. Were drifting across the sky in a Westerly direction."
1999-02-22,18:15,Great Missenden,Buckinghamshire,,"Three very large round, white objects. Extremely bright. Stationary, but then moved away very quickly."
1999-02-22,18:40,Skipton,North Yorkshire,,"Two very large round, white objects. One larger than the other. They were very bright. Just stayed stationary."
1999-02-22,19:13,Bradford,West Yorkshire,,"Two very large round, white objects. Very bright. Were stationary and then moved West."
1999-02-22,19:30,Leeds,West Yorkshire,,"Two very large round, white objects. Very bright."
1999-02-22,20:20,Minard,North Argyll,,"Stationary lights, that then disappeared and then reappeared."
1999-02-22,19:40,West of Glasgow Airport,Strathclyde,,"Two bright stationary lights, low on the horizon. The lower one was brighter. They were stationary in the sky for 30 minutes."
1999-02-22,18:30,Kings Langley,Hertfordshire,,Two static lights that were very bright and large. No movement at all.
1999-02-22,18:50,Wraysbury,Middlesex,,"Two very large, white objects that were very bright. One was larger than the other."
1999-02-22,19:45,Weston-super-Mare,Somerset,,"Two large round, white objects. Very bright light. The objects remained stationary for about 15 minutes."
1999-02-22,19:30,Bristol,Somerset,,"Two large round, white objects. Very bright. Were slowly moving West and lowering."
1999-02-22,18:50,St Monans,Fife,,"Bright light, pale blue and purple in the centre."
1999-02-22,20:09,Derby,Derbyshire,Police Officer,"Two large round, white/yellow lights."
1999-02-22,18:40,Glenrothes,Fife,,Two bright lights that were approximately one degree apart.
1999-02-22,19:00,Bolton,Greater Manchester,,Two objects. Top one had a pale white light. The bottom one had a red/green light. They glided along the sky.
1999-02-23,19:00,Burnley,Lancashire,,Disc with lights. Was hovering.
1999-02-24,19:00,Chingford,Essex,,Looked like Saturn - had a ring around it. Had lots of flashing lights. Could have been an advertising balloon.
1999-02-25,22:10,Barnard Castle,County Durham,,Bright yellow object. The object was moving from South to North.
1999-02-28,22:00,"A68, Corbridge",Northumberland,,"Approx. size of ten football pitches, shaped like an arrowhead. Moving towards and upwards."
1999-03-04,21:15,Lichfield,Staffordshire,,White lights.
1999-03-05,21:00,"M60, Manchester",Greater Manchester,,Rectangle/yellow light.
1999-03-05,22:30,Falkirk,Stirlingshire,,"One dozen objects. Red, green, blue and white colours. The objects were stationary and revolving."
1999-03-06,01:15,Worthing,West Sussex,,Black ball shaped object. Also looked metallic. Changed direction of travel from South to East. Quite fast.
1999-03-07,,Ballykinler,County Down,,"Lights seen at various times, after dark. The lights were triangle and diamond shaped. They were moving in different directions."
1999-03-08,,Seaforde Village,County Down,,Lights in a circle. They were spinning clockwise and oscillating.
1999-03-09,18:30,Ammanford,Dyfed,,Two dark grey objects. They then looked translucent. They were manoeuvring and then disappeared into the cloud.
1999-03-09,10:10,Newton Abbot,Devon,,"One large circle, not constant, as it changed. Yellow and very bright. The object was moving very slowly."
1999-03-10,20:30,Broughton/Scunthorpe,Lincolnshire,,"Bright star shaped light, about the size of a hot air balloon. Object was still, then dropped in height below tree line."
1999-03-10,10:30,Bangor,Gwynedd,,Flashing lights that were various colours. Shape unknown. Moving West.
1999-03-10,20:05,Chelsea - Football Club,London,Police Officer,Four yellow lights. Changed from square to diamond shape. The object was travelling from East to West.
1999-03-11,05:10,Newcastle Emlyn,Carmarthenshire,,"One, large, round white light. Very bright. Moving from West to East."
1999-03-13,21:25,Cardiff and Pontypridd,South Glamorgan,,"Cardiff - Set of one red, blue and yellow lights in a straight line. Very bright. Pontypridd - one set of bright white lights in a triangle."
1999-03-14,23:25,Penheridge,Staffordshire,,"Low flying, hovering, silent aircraft."
1999-03-17,23:30,Shavington/Crewe,Cheshire,,"One star sized object, brighter than a star. Stationary at first and then moved Westward."
1999-03-18,21:40,Bebbington,Merseyside,,Two round objects. They had a faint red glow. One reversed on itself and then travelled North to join the other one.
1999-03-20,00:50,Frankwell/Shrewsbury,Shropshire,,A triangle of lights that went across the witness with no sound. They were travelling from North to South at a fast speed.
1999-03-24,21:25,Falkirk,Stirlingshire,,"Large, glowing object, brighter than a starry glow and bigger than a star. Appeared to have a 'line' through it."
1999-03-25,21:30,Strathmiglo,Fife,,"One bright, white light. Object was static to the South."
1999-03-26,20:45,Carshalton,Surrey,,"One large, round object. White and very bright. Was travelling North West."
1999-03-26,20:40,Alford,Hampshire,,"One large, round object. White and very bright. Was travelling North West."
1999-03-27,21:00,Kilmarnock,Ayrshire,,Bright light.
1999-03-29,21:00,Tranent,East Lothian,,"Star shape - coloured red, green and blue."
1999-03-29,23:05,Newburgh,Fife,,Triangular UFO weaving from side to side and changing colour over Newburgh for two hours.
1999-03-29,21:30,Ardross,Ross Shire,,"One object, four times larger than Venus. Halogen coloured. Brighter than Venus."
1999-03-30,21:35,Ardross,Ross Shire,,"One object, four times larger than Venus. Halogen coloured. Brighter than Venus. Was stationary for quite a while."
1999-04-01,02:05,Llandovery,Dyfed,,One capsule. Blue and silver at rear.
1999-04-06,14:45,"M2, Faversham",Kent,,Lots of swirly white lights. 40-50 ft wide. Circular and very bright. Transparent like a jellyfish. Lights were coming and going.
1999-04-10,,Wem nr Shrewsbury,Shropshire,Pilot,One large circular object with bottom missing.
1999-04-10,10:30,Withernsea,Humberside,,"Irregular pattern of lights - coloured white, blue, yellow and red."
1999-04-13,21:15,East Belfast,Northern Ireland,,"Very bright point light - source light flashing white, with four quick flashes then a gap. Object climbed rapidly in 30 seconds."
1999-04-14,11:18,Lewes,East Sussex,,"Five circular objects. Green, red and white in colour. Extremely bright. They were moving North."
1999-04-15,02:19,Tooting,London,,One circular object. White and bright.
1999-04-22,,Dagenham,Essex,,"Object as large as a saucer, painted with a fine brush. Flicking now and again."
1999-04-29,16:00,,Mid-Glamorgan,,Circular shaped object. Too high to be a bird and too low to be a plane. Was travelling from East to West.
1999-04-29,21:27,Brockley,London,,"Boomerang shaped object, silent. Moving in a North East direction."
1999-05-01,21:25,Greenock,Renfrewshire,,Five lights going into a centre and breaking away to a circle. They were circling.
1999-05-04,22:15,Modbury,Devon,,One haze of light with two tyre like spheres in the middle. Was white with a yellow haze and was very bright. Stationary at first.
1999-05-16,00:15,Worcester,Worcestershire,,"One round object, very bright. Was yellow with a red flash."
1999-05-16,21:20,Poole,Dorset,,"Various rounded, orange/yellow objects. Very bright. Fourteen at once, down to three. Going Westerly."
1999-05-18,12:45,Elgin/Moray,Morayshire,,"One object, balloon shaped. Had a bright white glow. Moved slowly to the left and then stayed stationary for a while."
1999-05-19,08:21,Bexhill,East Sussex,,A bright light hanging in the sky. Looked like it had bits trailing off of it. Appeared to be stationary.
1999-05-22,22:00,Davyhulme,Greater Manchester,,"Round and a dull orange. Was swaying, while moving upwards, and then changed direction as if guided."
1999-05-23,23:00,Oakham,Leicestershire,,"Two large, yellow, bright lights. Didn't look like they were moving."
1999-05-24,20:45,Craigie Village,Ayrshire,,"Star shaped object with a tail above it. Was a yellow/white colour and very bright. Moving, but almost vertical. Then moved West."
1999-05-26,21:25,Liverpool,Merseyside,,"White light, very bright. Object approached slowly from the South, appeared to be stationary, before heading East and vanishing."
1999-05-26,21:35,Swansea,West Glamorgan,,"One object, white and very bright. Very high up and very fast."
1999-05-29,22:30,Bonnybridge,Stirlingshire,,"Very large, bright, star shaped object. Was low in the sky and hovering."
1999-06-05,22:58,Brighton,East Sussex,,"Very large circular set of lights in a tilted circle. Then split into two semi-circular arcs, then joined up again. White and very bright."
1999-06-08,00:00,Marlborough,Wiltshire,Private Pilot,"One circular, red, yellow, blue and green object. A strong brightness. It made sudden movements."
1999-06-08,22:35,Monmouth,Gwent,,"One object, the size of a hot air balloon. Was bright, with a honeycomb of light. Was stationary and then flew off."
1999-06-08,19:24,Rhymney Valley,Gwent,,"One metallic sphere, approximately five-six metres. Was flying erratically from South to North along the Rhymney Valley."
1999-06-09,23:15,Blithbury Reservoir,Admaston/Staffs,,"The object was round. Was green, red, blue and yellow in colour. It darted from left to right and toward the Witness's vehicle."
1999-06-11,,Salisbury,Wiltshire,,"Very bright, highly reflective object. Not like usual aircraft and did not have wings or a tail. Was rotating horizontally."
1999-06-12,01:05,Flint,Clwyd,,"Disc/star shape object with coloured lights, blue and green, spinning around it. Sphere of light high in the atmosphere."
1999-06-14,16:15,Algate,London,,"One thirty foot, silver ball/sphere. Vertical at first. Was still and then moved Southwards very gradually."
1999-06-24,22:19,Hove,East Sussex,,"Object - domed shape. It had a bright, white light and was flashing. Object was stationary for about 45 minutes."
1999-06-25,00:03,,Derbyshire,,"Line of lights, very intense. Steady red lights on top. Moving away at an angle moving to the right. They were horizontal."
1999-06-26,13:30,Blanefield,Ayrshire,,"Balloon shaped object, with bright yellow on top and a black, flat base. The object was smooth, straight and level."
1999-06-30,19:40,Kingsbury,London,,"One object, bullet shaped, rounded at the sides. Was jet black and very noticeable against the light evening sky. Headed North."
1999-06-30,,Kingsbury,London,,"One large, black object. It glided. Was oscillating and climbing. Moving North."
1999-07-03,22:10,Hemford,Shropshire,,"Single circular object, the size of a golf/tennis ball. White and very bright. Very slow."
1999-07-04,20:00,Holland on Sea,Essex,,"Oval transparent, except outer edge, object, which gave the whole appearance of a smoke ring. Outline was dark. Changed shape when it moved."
1999-07-05,23:10,Scunthorpe,Lincolnshire,,"Bright, white light with a red tinge. Vertical, then started moving erratically."
1999-07-06,01:15,Eastbourne,East Sussex,,"Saucer shaped, about 80ft in diameter. Was about 20ft to 30ft off the ground. It made a rattling sound. Six beams, bright light."
1999-07-10,00:51,Rillington,North Yorkshire,,"Circular object, size unknown. It was surrounded by red and green lights. There was static."
1999-07-10,20:55,Porthcawl,Mid-Glamorgan,,One cylindrical object. White and very bright. Was moving from left to right.
1999-07-10,19:00,Clayton,Greater Manchester,,"30ft, circular object."
1999-07-10,02:45,Scunthorpe,Lincolnshire,,"Bright, white light with a red tinge. Vertical, then started moving erratically."
1999-07-11,00:00,Llangynog,Powys,,"Like a medium, bright star. Made an unusual gentle ark. Then some strange squiggles from left to right. High up in the sky."
1999-07-12,11:45,Flint,Flintshire,,"One star shaped object. Coloured lights around it - green, blue and red. Spinning."
1999-07-12,13:45,Washingborough,Lincolnshire,,"One, small kite shaped object. Was bright white in colour. Formed an arc shape, then moved away."
1999-07-12,23:10,Blandford St Mary,Dorset,,Three star shaped objects. They were all white and very bright. They were faster than an aircraft.
1999-07-12,02:00,,Wiltshire,,Line of three orange lights. Two of them were close together.
1999-07-13,02:15,Eyres Monsell,Leicestershire,,"One object was a triangle shape and the other, a 'V' shape. Both had green and red lights. One was pulsating."
1999-07-14,21:45,Bushey,Hertfordshire,,"One object with four bright, white lights on it. It moved in a straight line."
1999-07-14,15:00,Peterlee,Durham,,Bright silver object. Was stationary.
1999-07-15,23:35,Halsted,Essex,,Blue lights darting around very quickly.
1999-07-15,00:00,Eastbourne,East Sussex,,"Numerous. Bright flashing. Like satellites, but definitely not. Were slow then fast."
1999-07-15,01:10,Dwyfach,Gwynedd,,A bright light.
1999-07-24,23:30,Redcliff,Somerset,,"Ten circular objects, variety. Brightness was less than a star. Object in line, doing zig-zags. Heading North."
1999-07-25,00:20,Coventry,West Midlands,,Illuminated disc - about approximately 4 inches in diameter. Was vertical. Was moving fast in a straight line.
1999-07-25,23:05,Murthly,Tayside,,One object roughly the size of a football or melon. Yellow/orange in colour. Went to a pinpoint and disappeared.
1999-07-25,22:25,Porthcawl,Mid Glamorgan,,"One disc shaped object, bluey silver in colour. Moved in a straight line. Definitely not a star or planet."
1999-08-01,10:30,Rochdale,Greater Manchester,,Balloon shape. There were lights round the object. Was hovering for some time.
1999-08-02,21:50,Boston,Lincolnshire,,Very bright light. Orange in colour. Much bigger than aircraft lights.
1999-08-03,22:30,Slough,Berkshire,,"Single disc, star sized. White in colour and bright like a star."
1999-08-04,23:30,Glenrothes,Fife,,"One small, very bright object with a tail. Changing colours. Slight movements - side to side."
1999-08-06,22:30,Loversall,South Yorkshire,,"Both UFOs were flashing different colours. They appeared to be hovering, but no shape could be seen."
1999-08-08,22:00,Ulverton,Cumbria,,Circular flashing lights. They made extremely strange movements.
1999-08-13,,Tenterden,Kent,,"A large, brilliant light was stationary in the sky. It moved away fairly quickly and disappeared."
1999-08-17,20:50,,Carlisle,,Two blue balls of light - dancing around in the sky.
1999-08-21,21:50,,Middlesex,,One orange ball. Very bright. Was humming. Moved in a straight line.
1999-08-21,21:30,Kinloss,Morayshire,,Two lights in the sky. Very bright.
1999-08-22,19:15,Thornton/Bradford,West Yorkshire,,A black saucer/disc which was making no noise and had a bright silver light which appeared to rotate round the saucer.
1999-09-01,18:30,Ealing,London,,"One object, aircraft size. Long, thin and black in colour."
1999-09-10,17:18,Oldham,Greater Manchester,,Round ball. Bright white in colour. Was horizontal.
1999-09-11,22:15,Livermead/Torquay,Devon,,"One large, cigar shaped object. Luminescent green and very bright. The object sort of glided along."
1999-09-11,19:45,Stowmarket,Suffolk,,One yellow object. Star brightness. 'Bouncing'
1999-09-12,19:42,Lower Stoneham,East Sussex,,"Six groups of coloured lights. White, green and red lights."
1999-09-12,21:20,Sellindge/Ashford,Kent,,"Bright light, not blinding, was heading South."
1999-09-13,16:30,,Guernsey,,"One small, circular object. White and extremely bright. Object appeared to be constructed of a lattice/trellis."
1999-09-13,01:40,Penarth/Cardiff,South Glamorgan,,"Large, bright object."
1999-09-13,23:00,Newbiggin By-The-Sea,Northumbria,,"Large, bright light hovering near the coastline. Looks like a large star with a small one on top. Red light coming from the middle."
1999-09-18,07:30,,London,,"One small, round, white/silver object. Extremely bright."
1999-09-19,20:20,Marlborough,Wiltshire,,"One car sized object. Tubular shaped. It had three lights at the front, and they were very bright. Moved off at a high speed."
1999-09-20,23:30,Malton,North Yorkshire,,"Flat rugby ball - shaped oval object. Had two flashing red lights at the ends. Circled then hovered, then headed off."
1999-09-22,21:25,Longden,Shropshire,,"One brilliant ball of light. The object climbed very high and very fast in the sky, and then disappeared."
1999-09-23,10:00,Leominster,Herefordshire,,"One large object, aircraft size. Bright light in front of object. Long, with wings. Jet sound and very fast. Black smoke coming from the rear."
1999-09-24,22:10,Glengormley,Co. Antrim,,"One object with a red light. Flew level, then climbed vertically, with a grey trail of smoke. Very fast."
1999-09-25,01:30,Tinshill,West Yorkshire,,"Oblong, flexible object. Red in colour. Was very bright and then dimmed a little."
1999-09-28,04:55,Lochgreen,South Ayrshire,,"Very bright, intense light. Flared up and moved left to right, very fast. Made sudden movements and quick direction changes."
1999-09-29,,Beddingham,East Sussex,,"One large, circular, flat, brown object. Was seen hovering."
1999-10-02,,Woolston/Warrington,Cheshire,,"A beam of light was seen over a school. A noise was then heard, but not that of a plane or helicopter."
1999-10-03,20:00,Dinnington,South Yorkshire,,"A light was seen in the sky and then a square shaped object appeared, with lights at each corner."
1999-10-04,21:09,Rosyth,Fife,,"One star shaped object, that was white. Had a very bright light. Moved fast in a straight line."
1999-10-05,21:55,Llanbedrog,Gwynedd,,"One object, larger than normal aircraft, tubular shape. Was bright green tinged with blue. Moved downwards leaving trail behind."
1999-10-09,21:15,Calne,Wiltshire,,"Two lights, one large and one small. White and very bright. They were moving from left to right and then to the left again."
1999-10-10,23:50,Foxham,Wiltshire,,A single white light. Was stationary for a while. Fans of light moving left to right and back.
1999-10-11,11:20,Clitheroe,Lancashire,,"One object, like a rounded saucer that was smaller than a bi-plane. Dark on top and light underneath."
1999-10-18,06:25,Ilford,Essex,,"One cylindrical object, that was the size of fuselage or a small/medium aircraft. Bright white. Moved rapidly upwards and then disappeared."
1999-10-18,02:00,Bath,Somerset,,"One object, the size of a medium star. Shaped like a ball with three prongs. Green, red, blue and white. Very bright."
