Date,Time,Town / Village,Area,"Occupation
(Where Relevant)",Description
2008-05-11,14:00,West Wycombe/H Wycombe,Buckinghamshire,,"There was a black object in the sky. It then turned on it's end, and disappeared."
2008-05-19,02:30,Rhydwyn/Caergybi,Isle of Anglesey,,"A round, bright white object. It was moving from SW to NE, and moved slowly and quietly."
2008-05-19,22:45,Delabole,Cornwall,,Three objects were seen travelling from South East to North West.
2008-05-19,22:45,Delabole,Cornwall,,"A very bright orange light, brighter than a star, three objects were sighted together. They accelerated over the sea."
2008-05-31,22:00,Leeds,West Yorkshire,,Two bright lights were moving fast from West to East. They were at typical jet height. They then went behind trees and just disappeared.
2008-05-31,23:09,Stranraer,Dumfries & Galloway,,A bright orange object. It was heading in a South Easterly direction.
2008-05-31,23:20,Millbrook/Torpoint,Cornwall,,"A very bright light zig zagged across the sky southwards, until it vanished."
2008-06-01,22:30,Worthing,West Sussex,,"At first, there was one light like a star, which was white with a tint of orange, and then another moving light appeared. They were travelling in a slightly Westerly, slightly Southerly direction. They travelled in a perfect straight line."
2008-06-02,20:30,Stroud,Gloucestershire,,A sighting of something.
2008-06-05,00:55,Tonbridge,Kent,,An object was flying around in circles at aeroplane level and sounded like an industrial train. There was a strange flashing on the object.
2008-06-06,22:59,Godrer Aran/Llanuwchllyn,Gwynedd,,Two orange lights were seen. They were fast moving. One moved to the East to Bala and the other one climbed vertically.
2008-06-07,00:30,Heathrow,Middlesex,,"Twenty five amber lights were seen leaving the Heathrow area. They were travelling West at 45 degrees, 200-300 knots."
2008-06-07,23:00,Croydon,London,,"A strange object was seen in the sky. It was around for several minutes, and then flew off."
2008-06-07,23:00,Westbury/Shrewsbury,Shropshire,,A UFO was seen.
2008-06-07,23:00,Tern Hill Barracks,Shropshire,,Thirteen craft were zig-zagging in the sky.
2008-06-08,00:25,Middleton/Ilkley,West Yorkshire,,There were five orange objects and then one orange 'blob' came into view.
2008-06-09,01:30,Norton/Stourbridge,West Midlands,,An object that had a flat top and a rounded bottom. It was roughly the width of a combined semi detached house. There was a dim humming sound.
2008-06-10,23:30,Shortstown/Bedford,Bedfordshire,,"A big orange, saucer shaped floating thing was in the sky. There were four flashing lights on it. It was like a light show. They then suddenly stopped flashing. This went on for over two hours."
2008-06-15,22:45,Waverton/Chester,Cheshire,,"A formation of eighteen lights. They appeared like a 'flock of helicopters' with lights on. They gave off no sound, but there was a slight rattle."
2008-06-17,Not stated,New Forest,Hampshire,,A UFO.
2008-06-20,19:30,Thorne/Doncaster,South Yorkshire,,"A metallic, capsule shaped object. There was no sound. The object was moving from South East to North West, and was going quite fast and didn't slow down at any point."
2008-06-20,23:00,Kendal,Cumbria,,"There was a quite low, red and an orange light. A bright, phosphorus white light fell from the orange light towards the ground, before disappearing. The red light was static throughout the sighting."
2008-06-22,01:00,Stanley/Wakefield,West Yorkshire,,"Five, bright, oval shaped orange lights. Three of the lights were in a group, and the other two were also in a group, travelling behind. They were flying from East to West."
2008-06-23,17:50,Welton/Lincoln,Lincolnshire,,A diamond/orb shaped object. Was white and bright. It never moved. It was a few thousand feet up in the sky.
2008-06-23,23:10,Barry,Vale of Glamorgan,,Eleven objects in the sky.
2008-06-27,23:45,Inverness,Inverness-shire,,One brilliant orange light. Then five orange lights moved slowly overhead. The orange lights moved from East to West.
2008-06-27,23:55,Inverness,Inverness-shire,,"Five orange, circular lights were seen in the sky, and a beam of light was also going up into the sky."
2008-06-28,Not stated,Not stated,Kent,,A UFO.
2008-06-28,Not stated,Cobham,Surrey,,Something interesting.
2008-06-28,23:40,Bedford/Arledsey,Bedfordshire,,There was a total of seven strange lights moving from North to South.
2008-06-29,Not stated,Yeovil,Somerset,,An orange ball up in the sky.
2008-07-01,22:30,Not stated,Devon,,UFO activity.
2008-07-02,21:30,Littlemore,Oxfordshire,,Sixteen square shaped objects appeared as silhouettes. They were travelling across the sky from South to North.
2008-07-03,23:30,Coventry,West Midlands,,There were two orange balls hovering a foot in front of the witness. They hovered from left to right.
2008-07-04,Not stated,Barnet,London,,A UFO.
2008-07-04,04:00,Wroughton,Wiltshire,,"One white light in the shape of a triangle. Was very bright. Estimated about 1,000 ft up."
2008-07-11,23:30,Scarborough,North Yorkshire,,"A cork shaped object that glowed like an angel, flew up and over some trees."
2008-07-12,09:35,Midhurst,West Sussex,,There were seven red glowing objects. They were moving from West to East.
2008-07-12,22:00,Davidstow,Cornwall,,"Two lights were briefly seen, before they disappeared into a huge cloud. They looked like bright orange stars."
2008-07-12,22:50,Horncastle,Lincolnshire,,"Eight circular large yellow, bright solid lights moving East, South East. They were moving at high speed, low level."
2008-07-12,23:00,Amberley,Gloucestershire,,A UFO. It was moving to the West.
2008-07-12,23:30,Oxted,Surrey,,Ninety orange lights were in a V or S shaped pattern. They were the size of footballs. They passed over the witness's house.
2008-07-12,23:52,Scarborough,North Yorkshire,,"A white pea pod shaped object, flew through a blue part of the sky and then through a cloud."
2008-07-13,22:00,Davidstow,Cornwall,,"Six lights were seen. They looked like bright orange stars, rising up into the air one after the other."
2008-07-14,02:14,Scarborough,North Yorkshire,,A UFO that was shaped like a fiery star. It flew through the sky and then disappeared.
2008-07-15,Not stated,Lowestoft,Suffolk,,A UFO.
2008-07-20,00:50,Chavey Down/Ascot,Berkshire,,"It resembled a white light, and was travelling at low speed. Was about two or three times bigger than Venus. Sometimes it looked like a spotlight, but there was no silhouette or shadow of an aircraft. There was no noise."
2008-07-20,03:30,Redruth,Cornwall,,"An object moved from North to West, then disappeared after moving towards the East."
2008-07-21,22:30,A6 near Buxton,Derbyshire,,"There was a distant bright light, like a huge star. A wide shaped object too, with white and coloured lights across it. It then disappeared overhead."
2008-07-23,21:00,Sutton-In-Craven/Keighley,West Yorkshire,,Two bright balls of light. One of the balls looked like it was chasing and trying to overtake an aircraft. The other ball just burst as it was moving and disappeared.
2008-07-24,22:15,Wellington,Shropshire,,"A really bright, burning orange light. The object was going at the speed of a helicopter."
2008-07-25,Not stated,Telford,Shropshire,,A UFO.
2008-07-26,Not stated,Northampton,Northamptonshire,,Eight strange lights.
2008-07-26,Not stated,Bristol,Avon,,A group of lights in a cluster. More lights gradually joined them. Several lights were moving across the sky. More lights joined them and both sets then disappeared.
2008-07-26,Not stated,Farnham,Surrey,,"Two, red round lights. The objects were moving across the sky in different directions and then just disappeared."
2008-07-26,22:00,Gosport,Hampshire,,"A silent aircraft passed overhead. It was clearly visible like a shooting star, but with a smooth curving course."
2008-07-27,Not stated,Scunthorpe,Lincolnshire,,"Oval shaped, weird light in the sky. The object moved from right to left and was moving in a Westerly direction."
2008-07-27,Not stated,Helston,Cornwall,,A mysterious sight in the night sky.
2008-07-27,Not stated,Shirley,West Midlands,,"A triangle shaped object, which had three white lights and one red light. There was no noise."
2008-07-27,02:00,No area given,Not stated,,"An object moved slowly at about 2,000 ft, raised vertically, then moved slowly away."
2008-07-27,16:30,Pontypridd,Mid Glamorgan,,An object was travelling at high speed. It appeared to be round like a football. It was travelling from South East to North East. It then disappeared.
2008-07-27,23:25,Leeds,West Yorkshire,,There was one lit up circle and then 24 appeared all spaced. They were all in the same line of path and moving at the same speed.
2008-07-28,23:05,West Kilbride,Ayrshire,,"Two spheres passed rapidly by, moving Northwards."
2008-07-29,00:00,South Croydon,Surrey,,A UFO.
2008-07-30,Not stated,A1/North of Darlington,Cleveland,,Ten orange/amber orb shaped ships. Some were in clusters and some were scattered.
2008-07-30,Not stated,Not stated,Not stated,,"A perfect triangular shaped, stone looking object was hovering about twenty foot in the sky. It had three lights on each point and the front nose cone was a blue light."
2008-07-31,Not stated,Godalming,Surrey,,A UFO.
2008-07-31,01:15,Bodmin Moor,Cornwall,,A UFO.
2008-08-01,22:30,Loughborough,Leicestershire,,Twenty to twenty five lights were moving across the sky. They were in a uniformed lighting formation.
2008-08-02,22:30,Winchmore Hill,London,,Lights in the sky.
2008-08-02,23:45,Bridgewater,Somerset,,A strange sighting.
2008-08-03,22:00,Barry,Glamorgan,,Three UFOs or something.
2008-08-07,22:25,Not stated,Buckinghamshire,,A bright red object.
2008-08-07,22:30,Brill/Aylesbury,Buckinghamshire,,A red light slow moving in the sky. The object was not terribly high up.
2008-08-11,22:05,Larkhall,Lanarkshire,,One single round light. It was orange/red in colour. It was moving South East. There was no sound at all.
2008-08-15,Not stated,Burbage/Hinckley,Leicestershire,,Two bright lights. It looked like a spectrum of light shone through the car.
2008-08-15,21:10,Argoed,West Glamorgan,,"Three bright orange lights/objects in the sky, about a mile away. One of the objects was black and disc shaped. It moved quick and was silent."
2008-08-23,21:56,Darlington,County Durham,,Two objects that both had two lights on them. Each object was moving independently from the other. There was no sound.
2008-08-24,21:00,Emsworth,Hampshire,,"There was a bright yellow light in the sky. The object was approximately 12,000 ft up."
2008-08-24,21:30,South Malling/Lewes,East Sussex,,Fifty nine lights in the sky that formed a 'V' shape. There were a few lights on their own. They were bright red and very big. They were silent.
2008-08-29,11:55,Westborough/Scarborough,North Yorkshire,,A black rectangular object that was wobbling in the sky. It then moved out of sight.
2008-08-29,22:41,Oakworth/Keighley,West Yorkshire,,A UFO. Was quite far away and too high to be a plane.
2008-08-30,17:40,Stroud,Gloucestershire,,Six orb shaped objects that were red and orange in colour. They initially formed a 'V' shape. They were floating around and then the central one zoomed off like the Captain Kirk Enterprise.
2008-08-30,21:41,Scholes/Holmfirth,West Yorkshire,,There was a sighting of lights in the sky.
2008-08-30,22:20,Whitburn/South Tyneside,Tyne and Wear,,"Sodium coloured lights were travelling North West. Initially, four circular bright lights were travelling in convoy. Two of the lights made a vertical change of direction. One looked like a bright orange orb."
2008-08-30,23:00,Westborough/Scarborough,North Yorkshire,,An orange circular shaped object.
2008-08-31,21:35,Littlebourne,Kent,,"Three very low, very bright lights were travelling in formation, then breaking off and doing acrobatics. Then a large globe-like object appeared and was changing colours in a pulsating way."
2008-09-01,20:44,Rothwell/Leeds,West Yorkshire,,"An orb shaped object, with a disc shape underneath, was in the sky for about ten to fifteen minutes."
2008-09-03,20:20,Mannamead/Plymouth,Devon,,"A large, bright pink light. Was about a kilometre away. It was floating towards the left and then accelerated and disappeared. Looked like two small pieces came away from it."
2008-09-03,21:45,Urmston/Manchester,Greater Manchester,,"There were four separate lights. One of the lights was huge, and it had different lights on it."
2008-09-04,22:30,Guildford,Surrey,,"A big, red diamond shaped object. There was no sound."
2008-09-04,22:40,Middlesbrough,Middlesborough,,The craft had bright green lights and a blue light that was moving quickly through the trees. It was very large and was moving extremely fast. It was silent.
2008-09-06,20:03,Laindon,Essex,,"Two large orange lights in the sky, were flying East rather quickly. One light flew around the other one, then they both moved away North, at a higher speed."
2008-09-08,00:10,Near Blackpool,Lancashire,,"An object, the shape of a chewing gum pack, black in colour and had three circles of lights underneath it, emitting a dull orange light. Was about 150 feet long and 50 feet wide."
2008-09-13,04:53,Not stated,Not stated,,"There was quite a large flashing object, just hanging in the air, quite high up. Underneath the object was an orange/red luminating light."
2008-09-14,01:07,High Wycombe,Buckinghamshire,,A UFO.
2008-09-19,20:44,Stoke on Trent,Staffordshire,,An orange ball which looked like it came up from the ground. It then shot up vertically into the sky and disappeared.
2008-09-20,20:00,Chatteris,Cambridgeshire,,"Multiple bright glowing objects, between 5- 10,000 ft heading from South to North."
2008-09-20,22:00,Calne,Wiltshire,,"Five super bright, glowing orange/pink orbs at low altitude. They had unusual flying characteristics and were totally silent in flight."
2008-09-20,22:55,Malton,North Yorkshire,,"There were circles of white lights with a set of fire coming from inside each of them. They were like hang gliders, totally quiet. The last circle had a red light. They were in a formation."
2008-09-21,22:15,Iver,Buckinghamshire,,"A stream of forty over-roundish lights. They were in separate formations, all in straight lines. They were a funny orange colour and were bright."
2008-09-22,Not stated,Glasgow,Glasgow,,A UFO.
2008-09-27,19:45,Southgate,London,,A large silent squadron of red/orange coloured flying craft. There must have been in excess of thirty. Maybe more. They were flying from West to East.
2008-09-27,Not stated,Bletchley,Buckinghamshire,,Something definitely odd.
2008-09-28,Not stated,Budleigh Salterton,Devon,,"There was a stationary object, too low to be a star. It was orange in colour. It moved once, and then twice in a straight line in a NE - SW direction."
2008-10-01,23:00,Felixstowe,Suffolk,,"Very fast, intense flashes. Then one of the flashes formed into a ball."
2008-10-05,19:50,Wolverhampton,West Midlands,,A number of mysterious lights moving silently overhead. There were three and then another three appeared.
2008-10-06,20:55,Not stated,Lincolnshire,,A very large inverted V shape of seven dull lights - greyish almost. There was no shell outline. It rotated slightly and then seemed to bounce. The lights then shot off individually at high speed.
2008-10-08,23:17,Newcastle upon Tyne,Tyne and Wear,,"A large, bright white object moving silently at fast speed in the sky at a very high altitude, heading from North East to South West. The colour then changed from white to red and then it stopped. It jumped to different parts of the sky."
2008-10-10,20:45,Cheltenham,Gloucestershire,,"There were five, what looked like strange orange fire balls. They were silent."
2008-10-11,00:35,A12/Colchester,Essex,,"Two bright lights were flying Northbound, in line about 500 yards apart. As they got nearer, they could only be described as two balls of fire."
2008-10-11,19:20,Portsmouth,Hampshire,,"A large, bright orange tube shaped craft. It was flying slowly across the sky in a North Westerly direction. It was stationary for a minute. It made 3-4 circles in the sky and then zoomed off to the East."
2008-10-11,23:00,Stafford,Staffordshire,,There was a craft that seemed unusual. It was a shining bright orange and was moving slowly.
2008-10-13,21:00,Buxton,Derbyshire,,"Seven orange orbs. They were in a formation of three and then two sets of two. They moved generally in a straight line, but with some 'dancing' in the sky."
2008-10-13,22:50,Balham,London,,A UFO.
2008-10-14,Not stated,Swansea,West Glamorgan,,"There was a continual orange, strange shape in the sky. There was a very odd light too."
2008-10-15,Not stated,Slough,Berkshire,,"There was a triangular object hovering a mile above the witness's house. It had a sort of pattern under it, like a sign. It also had three circular type of lights. There was a weird hovering sound. It then shot up in the sky and disappeared."
2008-10-18,20:05,A259/Brighton,East Sussex,,"A bright spherical light was hovering above a house. The object slowly departed to the East and it spun and shifted at a rapid speed upwards in a Northerly direction, before disappearing."
2008-10-24,00:10,Aylesbury,Buckinghamshire,,A UFO was seen moving across the sky.
2008-10-27,00:01,Snetterton,Norfolk,,"A very high object came from out of space, travelling ten times the speed of sound. It was followed by a loud whooshing sound. The object was declining and was travelling far faster than any jet can go."
2008-10-29,Not stated,Erbistock/Wrexham,Clwyd,,An unusual sighting.
2008-10-30,18:30,Wakefield,West Yorkshire,,"There was an orange object in the sky and it was the size of an aircraft. The object was about twenty miles away. It climbed into the sky very fast, and then disappeared."
2008-10-30,20:35,Dumfries,Dumfriesshire,,"There were two lights moving towards each other. They then merged, disappeared and re- appeared, but were apart. The lights were seen to the South West."
2008-11-04,17:40,Somerton,Somerset,,"The object was cigar shaped, was 80ft long and 30ft tall. Was orange in colour and looked illuminated. It had a rear, bright white light. It made a sharp right turn then disappeared."
2008-11-06,20:10,Rainham,Kent,,"A UFO, that looked like a yellowy light. The object was quite near and fairly low down in the sky. There was no sound."
2008-11-07,19:30,Twyford train station,Berkshire,,A flicker of light that seemed to jump a considerable distance around the night sky. It had lights that seemed to scroll from one side to another.
2008-11-12,17:23,Carlton nr Rothwell/Leeds,West Yorkshire,,The objects looked like Chinese lanterns. They were orange in colour and very bright. The objects moved very fast and were extremely manoeuvrable.
2008-11-14,16:50,Kirton nr Boston,Lincolnshire,,There were twelve lights in the sky. The lights started to fade and then two more brighter lights came towards the first twelve. They were not in any formation.
2008-11-15,21:20,East Grinstead,West Sussex,,Two very bright orange lights were travelling from West to East. The lights were vertically spaced. Then another bright orange light came over. There was no noise.
2008-11-16,18:55,Keighley,West Yorkshire,,Two objects.
2008-11-21,23:30,Stickford/Boston,Lincolnshire,,"A cloud type dull light with no noise. 100ft- 200ft from the witness's house. Was moving in an arc continuously at speed, from left to right."
2008-11-22,Not stated,Jersey,Channel Islands,,A UFO.
2008-11-25,17:10,Shrewsbury,Shropshire,,"A strange triangular shape in the sky, with the apex to the right. Metallic grey in colour, but the flat base end seemed to glow orange. Must have been at least fifteen feet long and ten feet wide."
2008-11-26,Not stated,Cheadle/Stoke on Trent,Staffordshire,,A UFO was flying through the sky.
2008-12-01,18:50,Wettenhall/Winsford,Cheshire,,A crest shaped object moving to the South East at the rear of the witness's property.
2008-12-01,21:30,Village of Llangwm,Pembrokeshire,,"A very bright light, which had a long white tail. It then shot across the sky and the whole field was lit up. The light then began to break up."
2008-12-06,23:45,Stratford upon Avon,Warwickshire,,"An orange ball. The object was stationary for about five minutes and then shot up into the sky, and out of view. There was no sound."
2008-12-10,15:49,Devizes,Wiltshire,,"A small, bright golden coloured orb. It flew past and was very rapid and then it disappeared."
2008-12-18,Not stated,Halesowen,West Midlands,,A string of fifty to sixty lights were seen in the sky.
2008-12-21,17:30,Scunthorpe,Lincolnshire,,"A bright flashing ""star"" in South West sky. Too bright for a star. Like a little fireball. It repeatedly got bright and then died down. Looked big but pretty far aware."
2008-12-24,19:50,Rottingdean,East Sussex,,There were fifteen UFOs/bright lights coming down from the Downs. They were travelling at very fast speeds.
2008-12-24,20:00,Felixstowe,Suffolk,,"An orange/red ball shot into the sky from a North Easterly direction. It travelled at terrific speed climbing all the time, then faded and disappeared. There was no noise."
2008-12-24,21:40,High Wycombe,Buckinghamshire,,There were fifteen lights moving across the sky about half a mile away. They were red and flickering. Then three lights formed a triangle shape. They were moving horizontally from left to right.
2008-12-25,Not stated,Perth,Perthshire,,A UFO.
2008-12-25,20:20,Glasgow,Strathclyde,,"Six objects in two lines of three, one line above the other. Emitted a very strong yellow orange light before disappearing in the distance to the west."
2008-12-25,22:40,Carlisle,Cumbria,,Four or five bright lights moving across sky north of Carlisle. Orange in colour. Retained a constant altitude then dissappeared from view heading westwards.
2008-12-26,02:30,Old Colwyn,North wales,,"Bigger than a helicopter, 250 metres up, silent, with something like a bar coming off it. 30 seconds later flew off over the sea followed closely by a helicopter"
2008-12-26,18:30,Southgate,London,,"There was a whole procession of lights in the sky. Big eight orange balls with a red, flaming triangle in the centre of all of them. There was no noise."
2008-12-26,19:00,Kennington/Ashford,Kent,,"Orange shape travelling NW to SW at fair pace, 2000ft plus. Bright orange. Similar shape to inverted light bulb. There was no sound"
2008-12-26,Not stated,Ilkley,West Yorkshire,,Two parallel UFOs were seen.
2008-12-26,Not stated,Wymondham,Norfolk,,Seven strange orange lights. Moving at great speed. Appeared one by one and remained stationary for 30 minutes before disappearing.
2008-12-27,22:10,Morecambe,Lancashire,,Unidentified objects in the sky.
2008-12-27,Not stated,Kensington,London,,"Two orbs, that were quite big, were seen dropping through the sky and disappearing behind some trees."
2008-12-29,19:00,Loughton/Adbridge,Essex,,Lights in groups of 3 or 4 but not in a line. They weere an orange/yellow colour. Watched for 30 minutes. They made no sound
2008-12-29,Not stated,Kettering,Northamptonshire,,There were some large objects in the sky. There was also a constant red light heading West. The objects were bigger than a plane.
2008-12-29,Not stated,Farnworth,Lancashire,,"There was a large, bright orange light. There was no sound. It moved slowly initially and then there was rapid movement and it disappeared out of sight."
2008-12-31,21:00,No area given,No area given,,Ball of fire sitting in the sky. Changed colour from red to orange. Diamond shaped. Moved up & down and backwards in circles and then shot up and disappeared
2008-12-31,Not Stated,Brightlingsea,Essex,Police Officer,"Bright orange/yellow light in the sky. Quite large, 1500-2000 ft up. Moved very slowly in a half circle then stopped over the water between Brightlingsea & East Mersea. Shot straight up and dissappeared very fast."
No Firm Date,07:00,Beccles,Suffolk,,"A bright light was seen. While moving in a Westerly direction, it started to change shape. The light was on a constant course. (Message taken 16 January 2008)."
No Firm Date,Not stated,Cardiff,West Glamorgan,,A UFO. (Message taken 10 January 2008).
No Firm Date,Not stated,Watchet,Somerset,,An object moving across the sky. (Message taken 21 January 2008).
No Firm Date,21:00,Burgess Hill,West Sussex,,Fourteen orange lights came through the sky in twos and then disappeared. (Message taken 28 January 2008).
No Firm Date,Not stated,Chester,Cheshire,,It was an unusual sighting of an object. (Message taken 31 January 2008).
No Firm Date,18:00,Keynsham/Bristol,Avon and Somerset,,"An object hovering in the sky. In one spot, there was a light running through the centre which appeared to be going around the object. (Seen in February 2008)."
No Firm Date,Not stated,Little Hampton,West Sussex,,It looked like a strange light. It was quite far in the distance. (Message taken 4 February 2008).
No Firm Date,Not stated,Thorney Island/Emsworth,West Sussex,,"There were twenty to thirty, bright orange lights, moving quite slowly from North to South at a 45 degree angle. They seemed to fan out as they moved. (Message taken 11 February 2008)."
No Firm Date,Not stated,Helston,Cornwall,,A UFO. (Message taken 13 February 2008).
No Firm Date,Not stated,Custom House,London,,A UFO. (Message taken 11 March 2008).
No Firm Date,Not stated,Slough,Berkshire,,A UFO. (Message taken 19 March 2008).
No Firm Date,Not stated,New Romney,Kent,,A UFO. (Message taken 20 March 2008).
No Firm Date,Not stated,Worksop,Nottinghamshire,,"Some strange slow, low flying lights, not separate, but all together, as if on a craft. The lights were red, green and yellow. (Message - 7 April 2008)."
No Firm Date,Not stated,East Ham,London,,A UFO. (Message taken 14 April 2008).
No Firm Date,Not stated,Bristol,Avon and Somerset,,Fleets of orange lights were moving across the sky. They had been seen for the past three weeks. (Message taken 21 April 2008).
