Date,Time,Town / Village,Area,"Occupation
(Where Relevant)",Description
1997-01-02,20:58,Immingham,Lincolnshire,(where known),"A large UFO, with all different colour of lights around it. Was stationary for some time, then started moving, making small erratic movements."
1997-01-02,23:35,Scunthorpe,North Lincolnshire,,An object that is continually changing colour. Normal star shape.
1997-01-03,07:45,Formby/Liverpool,Merseyside,,"An oval, cigar shaped object. When the object speeded up, the witness could see red and white lights around or underneath it."
1997-01-04,23:20,Beith,Ayrshire,,There were circular lights that were indistinct. The object was continually orbiting and tilting.
1997-01-13,21:00,Brockton,Staffordshire,,"One, North Star sized object. Red and green colours, brighter than a star. Was moving from West to North."
1997-01-13,19:35,Peacehaven,East Sussex,,"One star shaped object. It had white, red and green flickering lights. It was very high and moving very slowly."
1997-01-13,19:40,Eynsham,Oxfordshire,,"One object, larger than a light plane. Was circular and greenish in colour. Moved faster than a plane and then appeared to fall to the ground."
1997-01-13,19:00,Watlington/Kings Lynn,Norfolk,,"Two bright white lights and three green lights in a row, with a red light beneath, seen hovering above a field."
1997-01-13,22:30,Kessingland/Nr Lowestoft,Suffolk,,"Huge lights, like a child's sparkler, round, and as big as a house. There was no sound."
1997-01-14,20:00,Selby,North Yorkshire,,"One, star shaped object. It was multicoloured. The object was stationary for over two hours."
1997-01-16,08:45,Dunfermline,Fife,,"There was an orange glow in the sky. Small plane sized, cigar shaped object. It descended quickly."
1997-01-20,08:00,Rock/Nr Kidderminster,Worcestershire,,"Five lights were seen in the sky. They then formed into two dashes. One moved off, and then they all disappeared."
1997-01-20,07:00,Rochdale,Lancashire,,"Two white lights that were oblong shaped, and very bright. They were heading in every direction."
1997-01-20,06:55,Coppull/Nr Chorley,Lancashire,,"Three lights in a triangular formation. The lights split up and then proceeded in three separate directions, at the speed of the car."
1997-01-20,07:00,Henley-in-Arden,Warwickshire,,A triangle of three stars. One was stationary and the other two were moving at the speed of a plane. They were brilliant white.
1997-01-20,19:15,Bradford,West Yorkshire,,"Five, round shaped flashing lights. Red and white in colour. They separated and went in different directions."
1997-01-20,19:01,Invergary,Invernesshire,,Intermittent light was flashing red. Then two flying objects were seen.
1997-01-20,06:50,Dartmoor,Devon,,"Two objects/lights that were parallel. Were stationary for about 10 seconds. They moved away at speed, and then became brighter."
1997-01-20,16:45,Norwich,Norfolk,,"A green light seen in the sky, that moved in a curve, falling as it went."
1997-01-20,01:00,Woodford Green,Essex,,"Three triangular shaped objects. They were bright white, but also turned red, green and orange. They moved spot and then zoomed off."
1997-01-20,19:45,Caernarfon Bay,Caernarfonshire,,"A huge, blue, fast object in the sky. There was a cloud of smoke and it made the floor shake."
1997-01-24,03:10,Hainault,Essex,,"A round, glowing object, with a dome on top and another underneath. It had port holes and glowed white/yellow. Disappeared after a few seconds."
1997-01-24,19:05,Spey Bay Beach/Moray,Morayshire,,"One large, semi-circular shaped object. Blood red orange, very vivid. Similar to a street light. Object was stationary, then moved off."
1997-01-24,20:07,B260/Longfield,Kent,,"Three very bright objects, pulsating - white, green and yellow. They sometimes moved into a triangular formation."
1997-01-24,19:00,Spey Bay,Morayshire,,One object. Was bright red/orange in colour. Bright light. The object was moving downwards.
1997-01-25,21:00,Huddersfield,West Yorkshire,,"One object. Got larger as it came close. Was starlight shaped, with a blue light pulsating and was extremely bright."
1997-01-25,20:30,Marske By The Sea,North Yorkshire,,"One bright object. Collection of red, green and blue lights."
1997-01-26,00:30,Edinburgh,Fife,,"One object, in the shape of three dots. Flashing red, purple, blue and yellow lights. They looked like disco lights."
1997-01-26,20:40,A537/Chelford/Nr Macclesfield,Cheshire,,"One object, 50 metres across. Was round and dark, with white incandescent lights around it. With two very bright, red lights beneath it."
1997-01-27,10:55,Droylsden,Greater Manchester,,"One, silver/white metallic object. Stubby wings further back. Cylindrical. Low, growling hum. Two more objects were there for 2-3 minutes."
1997-01-27,20:23,Flamborough,East Yorkshire,,Two blue lights. Shape described as a flint sparking continuously. Both lights varied from being 30-100 yards apart.
1997-01-27,22:40,Newport,South Glamorgan,,A 'tube of light' coming down from the sky. It first looked like a star moving towards the car. Left a dust cover on the car.
1997-01-28,20:00,Swansea,Glamorgan,,Three white lights accompanied by a red light. They seemed to be many miles away.
1997-01-30,17:55,Marlow,Buckinghamshire,,One sphere shaped object. White light. It descended slowly to eye level and slowed and appeared to spin and accelerate and then disappeared.
1997-01-31,20:00,York,North Yorkshire,,"Two to three UFOs circling the area. They looked like fast moving, cloud shaped objects."
1997-02-02,20:10,Chester,Cheshire,,"Orange, round object that was very bright. Was high up and made a rapid downwards descent."
1997-02-02,14:25,Selkirk,Selkirkshire,,Mirror like object. It was flickering.
1997-02-02,07:30,Caerphilly,Mid-Glamorgan,,"Cigar shaped object, with wings but no tail. Jade green in colour. White lights through windows. Moved in a straight line."
1997-02-03,21:35,Coventry,West Midlands,,"One large, triangular shaped object. Very bright, and white in colour and green at the top. It was moving North."
1997-02-03,10:52,Farringdon,Oxfordshire,,"An oval shaped object, moving very fast."
1997-02-05,08:30,Beeston/Nr Leeds,West Yorkshire,,One object that was spherical shaped. It was silver in colour and very shiny and bright. It remained steady and then disappeared.
1997-02-06,23:30,Manchester,Greater Manchester,,"Disc shaped objects were seen. They were surrounded by lights. A Droning noise was heard. One shot off, but returned later with another identical object."
1997-02-07,08:05,Bathgate/Falkirk,Central,,"One object, like a vapour trail, (but too low down). White, but not bright. Not very fast."
1997-02-08,18:37,Southend to London,Essex,,"Two strange, white lights surrouned by coloured lights. Then two more lots of lights appeared. They were moving slowly towards London."
1997-02-08,19:30,Cross Green/Leeds,West Yorkshire,,"One object, round shaped, consisting of a large, bright light. It was moving from East to West."
1997-02-09,19:00,Mons Mill/Todmorden,West Yorkshire,,The object was spherical in shape. Was a solid blue colour in the centre. It was moving in a Westerly direction.
1997-02-09,19:00,,,,A very bright meteorite or space debris.
1997-02-10,23:00,Near Plymouth,Devon,,"A round, deep, red object. It was not lit up and didn't have any lights. It was moving from West to East and was very high. 4-5 times faster than an airliner."
1997-02-10,09:35,Barry,Glamorgan,,One oblong object. It was red in the centre and had up to fifteen lights. There was constant movement.
1997-02-14,15:10,Maidstone,Kent,,"Two, small, triangular shaped objects. Black in colour. The objects were heading North and then disappeared into cloud."
1997-02-14,07:45,Stretham,London,,One airship shaped object. It was black. It was drifting smoothly.
1997-02-14,08:15,Roath/Cardiff,Glamorgan,,"One, triangular shaped object. A shiny, golden colour. It was moving in a straight line and was fast."
1997-02-15,23:00,Westbury,Wiltshire,,The object was believed to have landed on top of the Westbury White Horse Beauty Spot in Wiltshire.
1997-02-18,22:06,A449/Llanwern/Newport,Monmouthshire,,There was a cream coloured light.
1997-02-27,21:00,Gloucester,Gloucestershire,,"Five round, glowing objects. They were moving up and down and side to side, and were quite fast."
1997-02-23,19:20,Chelsea,London,,"One, very large, oblong shaped object.Yellowy/blue in colour. The object was stationary."
1997-02-26,21:45,A346/Nr Marlborough,Wiltshire,,"One object, green in colour and about 200 feet in the air. It had a very, long, green tail behind it."
1997-03-05,02:30,East Winch/Kings Lynn,Norfolk,,"White light, not unlike A/C landing light, with a faint beam or trail. Was stationary and then there was some movement."
1997-03-05,21:00,Edale/Lake District,Derbyshire,,"Triangular shaped object. It was green/yellow in colour and had pulsing lights. It made rapid, jerky movements and moved position."
1997-03-05,23:00,East Woodford,London,,"One object, similar to aircraft size, but triangular shaped. It was light in the centre, but the rest was dim white. Moved left/right, and stop/started."
1997-03-05,22:35,Enfield,Middlesex,,"A pink/red, round object. A bit came off the side and fell down. The object was flying in a North Westerly direction."
1997-03-06,18:30,Crondall,Surrey,,The object was at an angle. It was round with a dome on top. It had lights all around and internal lights. It was stationary and then hovered.
1997-03-08,07:10,Childwall/Liverpool,Merseyside,,"One object, car headlight size. Was white and very bright."
1997-03-08,19:05,Ayr,Ayrshire,,The object was like a star with a tail. There was a glow all around it. It was stationary.
1997-03-08,05:30,Salford,Greater Manchester,,Two objects. One was solid and charcoal grey and the other was more like a bright light. They zig zagged and then moved away vertically.
1997-03-09,03:45,Southend Beach,Essex,,"A metallic blue object. It hovered above the sea, and then crashed into it."
1997-03-10,03:45,Llanfair Caereinion,Powys,,A round ball with a tail. Was like a torch with a flare. There was no movement.
1997-03-11,20:26,Lynas-Wal/Llaneilian,Isle of Anglesey,,One object with white and red lights.
1997-03-12,19:30,Montrose,Tayside,,"One, round, very bright object, with static beams shining down."
1997-03-12,20:45,M40/Gaydon,Warwickshire,,"Five, pure white lights. They were very fast, and went from horizon to horizon in two-three seconds."
1997-03-13,20:50,Warwick,Warwickshire,,One huge big circle of bright white light. Was high in the sky and was circling around.
1997-03-15,20:30,A483/Wrexham-Newtown,Denbighshire,,"One, large, oval, white and very bright object. The object was straight and level and was moving parallel with the car."
1997-03-18,23:20,Elgin,Morayshire,,Three lights. Then there was a blue flash about 500ft up.
1997-03-18,04:00,Kingstanding/Birmingham,West Midlands,,"One large, triangle shaped object. Lit up blue. 200 ft in length. A very bright light in each corner. Hovered, then shot off. Left a substance of which he has some in a jam jar."
1997-03-19,08:40,Birmingham Airport,West Midlands,,A small object that was moving very strangely.
1997-03-19,21:50,Kidderminster,Worcestershire,,"One, large, cigar shaped object, with four individual red/green lights. Very bright. Was moving very slowly and moving from left to right."
1997-03-19,21:15,Stoke-on-Trent,Staffordshire,,"One large, round, white object. It was larger than aircraft lights. Very bright."
1997-03-20,06:00,Coventry Airport,West Midlands,,"Saucer shaped object, like a dull grey cloud. It was moving slowly, but faster than a cloud."
1997-03-21,22:31,Crawley,West Sussex,,"A peculiar object, that looked like a flock of birds, with a hole in the middle, leaving a vapour trail across the sky. Had orange lights around it."
1997-03-27,20:40,Bedworth,Warwickshire,,"Two objects were side by side. They were white and very bright. During the incident, the car radio was producing static."
1997-03-28,20:00,A70/Edinburgh,Fife,,"Two, very large, round objects. Larger than aircraft lights. White and very bright. They were in line with each other. Were moving Northwards."
1997-03-28,19:43,Manchester,Greater Manchester,,One object. Dark black and a triangular shape. Small red light on the nose. Two white lights on the edges that were flashing.
1997-03-29,,Southport,Lancashire,,A triangular object. Was hovering off of the coast.
1997-03-29,,Burslem/Stoke-on-Trent,Staffordshire,,"Three objects (lights), that were orange/red in colour. Were 500 yards apart of each other. They were moving from left to right."
1997-03-30,22:30,Wigan,Greater Manchester,,The object was a similar size and shape as a star. Blue and white in colour. It occasionally changed to red. It twinkled.
1997-03-31,22:00,Didcot/Oxford,Oxfordshire,,"Lights in the sky, which were white, then green, red and blue. Was stationary and then moved from left to right."
1997-03-31,18:50,Wythall/Nr Birmingham,West Midlands,,"One jumbo sized, missile shaped object. Very long. Had fins at rear. White, with an amber glow at the rear. Engine noise. Straight and level."
1997-03-31,23:45,Hemel Hempstead,Hertfordshire,,"An object with pieces of fire coming off of it. It was moving fast through the sky, and the witness thought that it may crash."
1997-04-01,20:05,Hanwell,London,,"One, round object. Very bright. It was slow."
1997-04-01,20:00,Notting Hill Gate,London,,"An orange blob, with a long fiery trail from the top, and twenty times longer than wide. Like a hot air balloon coming down, leaving a trail."
1997-04-07,20:50,East Grinstead,West Sussex,,One star shaped object. White and bright. Travelling in a direct line and was exceptionally fast.
1997-04-08,09:01,Penycae,Denbighshire,,An object was moving in 90 degree angles. It sped up and then slowed down.
1997-04-08,21:00,Wallington,Surrey,,"One object, like a dot of light. White and fairly bright. Was vertical. Moved very fast."
1997-04-08,21:30,Over Isle of Arran,Isle of Arran,,"A circular ball of light, which changed to green and then red in colour. It travelled horizontally across the sky."
1997-04-09,09:15,Lowestoft,Suffolk,,"A bright, white light, which had a circle of lights and a triangle in the middle, and also, three large, mauve/blue spots. It hovered, then shot off to the West."
1997-04-09,20:30,Elland,West Yorkshire,,"Three objects, green in colour. Horizontal - and approximately the size of traffic lights. Were steady and going from West to East."
1997-04-10,18:24,Aylesbury,Buckinghamshire,,"A sequence of flashing lights, which changed colour - red, blue, green and white."
1997-04-10,04:30,Brighton,East Sussex,,Bright light which was green. It had a purple haze. It moved in a straight line and was low in the sky and slow. Very quiet.
1997-04-11,21:45,West Parley/Ferndown,Dorset,,"A saucer shaped object. Had red and blue lights on it. It was hovering silently, and then disappeared behind trees."
1997-04-12,15:45,Warminster,Wiltshire,,"A dish shaped, very shiny metallic object. 15-20 metres in diameter. 5-6 metres deep. It moved slowly and then sped off."
1997-04-13,21:30,Erith,Kent,,"One, round shaped object. Very bright. It was white in colour, then turned to a red dot and sped off."
1997-04-13,22:00,Penarth Marina,South Glamorgan,,There were two identically sized crafts. Extremely bright and both an obscured shape. They oscillated in an eliptical pattern.
1997-04-14,00:45,Thornley Bank,County Durham,,"One, bell shaped object. It had one red light and one bright, white light. It was moving across the sky from West to East."
1997-04-15,21:15,Chichester,Hampshire,,One triangular shaped object. It was light yellow at the front and the rest was black. It moved sideways then stopped. It disappeared at speed.
1997-04-15,20:00,Lower Morden/Wimbledon,Surrey,,One object that was saucer shaped. Was white/orange in colour and very bright.
1997-04-16,21:30,Paignton,Devon,,"One object, like a star, but larger. Star coloured and very bright. It was moving very fast."
1997-04-17,00:08,Datchet/Slough,Surrey,,"Two round, white lights. They were performing circles."
1997-04-17,21:30,Ramsey,Cambridgeshire,,"Red, white and blue lights in a triangle shape, were flying across the sky."
1997-04-18,,Dublin/Amsterdam,,Airline crew,An unidentified flying object was seen.
1997-04-22,19:50,Bristol,Somerset,,"Two-five disc like objects. Green on left and yellow on the right. They were bright. Were moving, dropping and then re-appearing in the sky."
1997-04-22,21:55,Andover,Hampshire,,"A very large, grey object, with red, blue and green lights. There was a very loud humming noise. It came lower and nearer to the witness."
1997-04-30,12:45,Liverpool,Merseyside,,Two objects. The first one was disk shaped and the second one was cigar shaped. Both were black. They were slow moving.
1997-04-30,12:40,Birmingham Airport,Merseyside,,"A bright object rose from a roof top vertically, to a great height. It was a flat elongated shape and appeared to be grey inside."
1997-05-01,03:56,Cathays/Cardiff,South Glamorgan,,One round object with lights. There was one medium constant light.There was an unusual noise. It made erratic jerky movements.
1997-05-04,04:00,Epping,Essex,,"One round object, 15 ft in diameter. Was emitting 7 or 8 green lights downwards. Quite bright. There was steady movement."
1997-05-04,22:00,Worcester,Worcestershire,,"One object, the size of the North Star. Round and orange and yellow in colour. Quite bright. Was stationary and then there was steady movement."
1997-05-05,09:40,Maidstone,Kent,,One round shaped object. Green in colour and was very bright. It was very fast.
1997-05-07,03:00,Edinburgh,Fife,,Diamond shaped object. Yellow and white in colour and was flashing. It was darting around the sky.
1997-05-07,00:00,Calne,Wiltshire,,"One, triangular shaped object. The size of a small light aircraft. Was very bright. It made a sort of a buzzing noise. The object followed the witness."
1997-05-11,20:05,Looe,Cornwall,,One cube shaped object. Was the size of a micro light aircraft. Was black in colour. It moved straight across the sky.
1997-05-14,23:30,Witney,Oxfordshire,,"One very large star, with a slight beam, twinkled all different colours. It hovered back and forth for about 1 and a half hours."
1997-05-15,01:40,Bathgate,West Lothian,,Cylindrical object. Was slow moving.
1997-05-15,23:59,Runcorn,Cheshire,,"15-20, tail shaped objects, making snaking movements like a tail on a kids kite across the sky. They were orange and very bright."
1997-05-19,23:17,Bromley,Kent,,"One round shaped object, double the size of a star. White (pale), but very bright. It was stationary for a while and then travelled straight and level."
1997-05-21,00:45,Bradford-on-Avon,Wiltshire,,Blue flashing lights with no shape. There was a strange noise that woke the witness. The flight was straight and the lights were moving North.
1997-05-22,23:10,Abergavenny,Monmouthshire,,"One large, triangular shaped object. Black in colour. Was moving to the West."
1997-05-23,23:30,Zennor,Cornwall,,"A brilliant white light, travelling at alternating speeds. It disappeared and then minutes later, the same light came from an egg shaped object, that was hovering."
1997-05-27,04:20,Gorseinon nr Swansea,West Glamorgan,,"One round object. Yellow in colour, bright and shimmering. It was moving from left to right."
1997-05-29,23:55,,Suffolk,,"10-20 lights in the sky. The objects were flashing red, orange and green like traffic lights. They were stationary and silent."
1997-05-29,20:58,Harpenden,Hertfordshire,,"One short object, like an aircraft and trail. Was white and very bright. Stationary, then moved to the North from the South. It disappeared instantly."
1997-05-30,00:20,Hatfield Woodhouse,South Yorkshire,,"Large object, helmet shaped. Had bright, white lights on the underside, and was completely silent. Was moving slowly and then sped off."
1997-05-30,10:57,Wrexham,Denbighshire,,"One object, with one light on the front. About 450 ft up. It moved West and picked up speed."
1997-05-31,,Wandsworth,London,,"One large, star like object. White in colour. Was moving slow from North to South."
1997-05-31,22:55,Barton/Torquay,Devon,,"A ball of white light slowly moving across the sky. Through binoculars, there was a white globe of light."
1997-05-31,12:05,Wokingham,Berkshire,,"An intense white, flashing light. It was drifting slowly overhead due West."
1997-06-02,03:00,Arran,The Isle of Arran,,"A bright star like shaped object, changing into an eliptical shape. It was rising slowly."
1997-06-02,02:20,Scunthorpe,Lincolnshire,,A big red dome with a bright red light. There were then white lights. It moved in a straight line.
1997-06-02,06:00,Bognor Regis,West Sussex,,A solid round ball - approximately 100 ft in diameter. It changed colour from dark red to black. A beam of light came from the object on to the witness.
1997-06-03,22:18,Kilmarnock,East Ayrshire,,A small intense ball of light. White in colour. It was travelling in a straight line and then made erratic movements and moved East.
1997-06-04,02:07,Kettley/Telford,Shropshire,,"A circular object, with four of five lights around the perimeter. It travelled slowly to the North."
1997-06-06,16:18,Gwernaffield/nr Mold,Flintshire,,"A round, black object was travelling across the sky at speed. There appeared to be something draping from the bottom."
1997-06-06,11:25,Woodley/Reading,Berkshire,,"Numerous, ball shaped, white lights. They were very bright. They were high in the sky, rapid, moving horizontal and round and round and up and down."
1997-06-08,00:20,Sandown,Berkshire,,"Two, round shaped objects. One had a white, steady light, and the other had a flashing white light. Both very bright. They moved South East."
1997-06-09,01:22,Canvey Island,Essex,,A solid white line.
1997-06-09,22:35,Calne,Wiltshire,,"One cylindrical/cigar shaped object. Was bright white. It made a rocket noise and was very loud. Very close, was horizontal and moved very fast."
1997-06-09,22:25,Tore,Ross-shire,,"One object, that looked like a saucer shape and then a comet with a tail. It was very bright orange and shining."
1997-06-09,10:50,Nr Ilkley,West Yorkshire,,"A cigar shaped object was travelling from North to South. It was silver/blue in colour. It was about 20,000 ft up."
1997-06-09,,Otley,West Yorkshire,,A long cylindrical shaped object. Was silvery white in colour and extremely bright.
1997-06-09,11:00,Otley,West Yorkshire,,"A long, cigar/oval shaped object. It was a dark grey/silver colour, when moving. When stationary, the silver colour became bright."
1997-06-09,00:30,Chesterfield,Derbyshire,,"There were five lights in a star shape, at an angle of 20 degrees, which were rotating and changing colour. The lights also appeared to pulsate."
1997-06-11,12:22,,,,"A man/alien walked in and layed on the witnesses quilt, then whooshed through the window."
1997-06-11,11:30,Isle of Wight,Hampshire,,Lights were seen over the Isle of Wight.
1997-06-10,00:04,Newhaven,East Sussex,,A big ball of white light was moving in a South Westerly direction. It then disappeared into nothing.
1997-06-14,09:30,Luton,Bedfordshire,,"One small plane sized, round shaped object. It was black (tar), in colour. It was stationary and then shot directly upwards in the sky."
1997-06-15,21:00,Brierly Hill,West Midlands,,A group of about twelve white lights. They were moving West. They were fast.
1997-06-15,01:30,Bishops Waltham,Hampshire,,"One, then many objects, that were brighter than a normal star. They were elongated and had white flashing lights. Were very bright."
1997-06-16,01:45,Hartley,Kent,,One object that was balloon shaped. Was orange in colour and moving low in the sky.
1997-06-16,02:36,,West Midlands,,"Solid, silver objects seen below cloud level."
1997-06-16,,Dumfries,Dumfriesshire,,"A metallic object was seen. A blue, green and yellow light came from it. It was very bright."
1997-06-04,02:07,Kettley Bank/Telford,Shropshire,,"A circular shaped object, with 4 - 5 lights on it's perimeter. It travelled in a Northerly direction."
1997-06-12,14:00,,West Sussex,,A UFO was seen. It was 100 ft high in the sky. It was a circular shape and had three lights on it. It moved quite slowly.
1997-06-17,22:30,Clitheroe,Lancashire,,"One round, very bright object. It was moving from East to West and going very fast."
1997-06-18,21:35,Northallerton,North Yorkshire,,"One object, the size of a small civil airliner. It was moving to the East. Looked like the object took a sidestep to the right."
1997-06-21,,Penrith,Cumbria,,"One object, the shape of a star and the brightness of a star. It moved fast, and then stopped and then sped off."
1997-06-23,22:35,Hythe/Southampton,Hampshire,,The object was oblong shaped and had lights. It moved too fast for an aircraft.
1997-06-22,22:10,Malmesbury,Wiltshire,,One very large object. It was orange/yellow in colour and very bright. It shot up into the sky.
1997-06-22,01:00,Carlisle,Cumbria,,"Three extremely bright lights, that then moved to form a huge triangle. The lights were of a similar brightness to a welding torch."
1997-06-25,02:20,,West Lothian,,"One barbeque shaped object. Had green and white still lights on it. Was very low, about a house and a half away."
1997-06-28,01:00,Troon,South Ayrshire,,"Segments of pale blue lights in a circle. It was stationary, then lights vanished and reappeared again."
1997-06-30,23:20,Norwich,Norfolk,,"One object, that appeared to be triangular or diamond shaped. Orange in colour and very dull. Was circling and moved away quickly and disappeared."
1997-06-30,21:00,Roydon,Essex,,"A vague shape of an aircraft getting bigger. Looked like a light too. It got closer, then stopped, then started moving again."
1997-07-01,01:00,Exeter,Devon,,"Two triangular shaped lights, one above the other could be seen."
