Date,Time,Town / Village,Area,"Occupation
(Where Relevant)",Description
2002-08-21,11:00,Fortrose,Highlands,,Small torpedo shaped object with a white or silver triangular reflector to one side.
2002-08-22,22:25,Heathfield,East Sussex,,Aerial lights seen in the sky.
2002-08-22,21:30,Shropham,Norfolk,,Aerial lights seen in the sky.
2002-08-22,22:25,Heathfield,East Sussex,,Anomalous aerial lights were seen.
2002-08-26,00:00,Dundee,Tayside,,Strange red and white lights seen through curtains. Then there was a solid red beam outside the window for about five to ten seconds.
2002-08-29,00:30,Leicester,Leicestershire,,"Looked like a shooting star. Had four lights on each side, like a black shadow."
2002-09-01,17:00,Leicester,Leicestershire,,"One object, that was golf ball size. Then another three golf ball size objects (white), were seen moving in an L formation."
2002-09-05,,Wisborough Green,West Sussex,,Interesting lights on an equilateral triangle.
2002-09-10,23:23,Hamilton,Strathclyde,,"There were three objects, each of which had two bright orange lights, in a triangular formation. Seemed to swap places with each other!"
2002-09-10,19:45,Tibbermore,Tayside,,"One small, bright, oval shaped object. The object seemed to elongate as it got closer."
2002-09-11,10:40,Kirkcaldy,Fife,,"There were three hanging silver rods. They were drifting slowly, then became bright silver and then faded away."
2002-09-18,19:20,Halstead,Essex,,Display of three lights in a sort of a star shape. The lights were in formation - circling.
2002-09-19,21:20,,,,"A circle of twenty lights, were seen outside the witnesses house for about twenty minutes."
2002-09-19,22:21,Bradford,West Yorkshire,,"Two circles, one inside the other. Were 50/50 feet in diameter. The brightness varied as they passed through the clouds."
2002-09-23,17:40,Huddersfield,West Yorkshire,,"One silver cigar shaped object, that split into six small silver balls. They were travelling erratically, but remained as a group."
2002-09-23,01:00,St John's Wood,London,,The object was a triangle shape with red flashing/alternating lights that went round the inside edges of the object.
2002-09-30,22:00,Exeter,Devon,,Object had two neon blue lights at the rear.
2002-09-30,23:30,Cannock,Staffordshire,,"The object looked like it was three times bigger than the size of a jumbo jet, like ""a gigantic flying piece of street""."
2002-10-03,20:20,Exeter,Devon,,One ball of red glowing light.
2002-10-04,21:30,Everett,USA,,"Five objects were circling above the head of the witness, at about fifty ft. Heard a low pitch noise. There was a blue and white type nucleus centre."
2002-10-04,20:30,Southend,Essex,,"One white, very small object, very high up in the sky."
2002-10-17,02:54,Hull,East Yorkshire,Two Police Officers,"Appeared as the size of a 'normal' bright star, but of different colours - blue, green, red and white. The object moved fast."
2002-10-23,07:04,Woodbridge,Suffolk,,Large silver triangle which then changed shape. Was clouded in a pink and green haze.
2002-10-25,01:30,Liverpool,Merseyside,,"Object looked like an upturned saucer, with a dome on top. It had amber lights, and the dome had a light on top. Was hovering."
2002-11,14:30,Walcott,Lincolnshire,,"Dark, black torpedo shaped object. White plume of smoke."
2002-11-02,23:00,Gors-goch,Dyfed,,Round yellowish light followed by a green light. Went up vertically.
2002-11-02,22:58,Llanerchymedd,Gwynedd,,"One light, the size of a football moving slowly at about 2-3000ft."
2002-11-07,06:30,Wolverhampton,West Midlands,,"Two sets of lights, with an aircraft in the middle of them."
2002-11-09,22:00,Lechlade,Gloucestershire,,Series of lights moving in an arc. They were pink and spaced out.
2002-11-11,23:00,Nottingham,Nottinghamshire,,"Eight objects joined into a circle, then separated. Moved independently, then joined together again in a circle."
2002-11-14,22:12,Saddleworth Moor,Gtr Manchester,,"Small football size white light, with a blue tail."
2002-11-15,12:15,Eyam,Derbyshire,,"Large flying object, witness had never seen anything like it before. No lights whatsoever."
2002-11-15,21:30,Liverpool,Merseyside,,Series of eight to ten lights all tracing a pattern in the sky.
2002-11-24,20:00,Bohuntine,Highlands,,"Round orange shaped object, with pale green lights shining out in all directions. (A possible halo)."
2002-11-28,14:26,Cardiff Docks,South Glamorgan,,Two sightings over Cardiff docks. The objects were of different colours and were moving up and down.
2002-12-09,17:30,Bishop's Stortford,Hertfordshire,,"Small round, dull light seen."
2002-12-10,18:27,Stoke-on-Trent,Staffordshire,,Saw an orange disc shape.
2002-12-16,02:35,"M62, Near Rothwell",West Yorkshire,,"A number of objects - quite large, long, thin and shaped like cuttlefish. Joined to become a rectangular, vertical light, skimming along."
2002-12-18,16:40,Coningsby,,,"Bright oval shape cluster of lights, that grew brighter than the moon."
2002-12-19,06:30,Chaldon,Surrey,,"Very bright object, with an orange/yellow triangle behind it."
2002-12-19,06:30,Notting Hill,London,,"Very large object, falling like a shooting star. Flames were coming out of the back. (Could have been a satellite re-entering)."
2002-12-19,06:30,Brighton,East Sussex,,"Large cylindrical object, white flowing light from the front and flames coming from the rear. Some noise, not loud."
2002-12-19,06:30,Newton Abbott,Devon,,A strange object/light. No sound.
2002-12-24,10:39,Aylesbury,Buckinghamshire,,"Orange object, with a lighter coloured trail, about ten times the length of the head."
2002-12-28,20:10,"On A31, nr Hogsback",Surrey,,Four pairs of lights.
2002-12-29,00:00,7 miles past Lancaster,Lancashire,,On M6. Bright green light about the size of a traffic light arched over and came down to the ground and broke up.
,,Solihull,West Midlands,,Saw two bright lights. (Seen in 2002).
,,Welwyn Garden City,Hertfordshire,,"One disc shaped object, that was tangerine coloured. Zig-zagged for a while and then departed after fifteen seconds."
,,Television Studio,,,"A black tube appeared in the studio, two doors opened and then closed. It rose to the ceiling and then disappeared. Moved around."
2002-08-26,00:00,Dundee,Tayside,,Strange red and white lights seen through curtains. Then there was a solid red beam outside the window for about five to ten seconds.
2002-08-29,00:30,Leicester,Leicestershire,,"Looked like a shooting star. Had four lights on each side, like a black shadow."
2002-09-01,17:00,Leicester,Leicestershire,,"One object, that was golf ball size. Then another three golf ball size objects (white), were seen moving in an L formation."
2002-09-05,,Wisborough Green,West Sussex,,Interesting lights on an equilateral triangle.
2002-09-10,23:23,Hamilton,Strathclyde,,"There were three objects, each of which had two bright orange lights, in a triangular formation. Seemed to swap places with each other!"
2002-09-10,19:45,Tibbermore,Tayside,,"One small, bright, oval shaped object. The object seemed to elongate as it got closer."
2002-09-11,10:40,Kirkcaldy,Fife,,"There were three hanging silver rods. They were drifting slowly, then became bright silver and then faded away."
2002-09-18,19:20,Halstead,Essex,,Display of three lights in a sort of a star shape. The lights were in formation - circling.
2002-09-19,21:20,,,,"A circle of twenty lights, were seen outside the witnesses house for about twenty minutes."
2002-09-19,22:21,Bradford,West Yorkshire,,"Two circles, one inside the other. Were 50/50 feet in diameter. The brightness varied as they passed through the clouds."
2002-09-23,17:40,Huddersfield,West Yorkshire,,"One silver cigar shaped object, that split into six small silver balls. They were travelling erratically, but remained as a group."
2002-09-23,01:00,St John's Wood,London,,The object was a triangle shape with red flashing/alternating lights that went round the inside edges of the object.
2002-09-30,22:00,Exeter,Devon,,Object had two neon blue lights at the rear.
2002-09-30,23:30,Cannock,Staffordshire,,"The object looked like it was three times bigger than the size of a jumbo jet, like ""a gigantic flying piece of street""."
2002-10-03,20:20,Exeter,Devon,,One ball of red glowing light.
2002-10-04,21:30,Everett,USA,,"Five objects were circling above the head of the witness, at about fifty ft. Heard a low pitch noise. There was a blue and white type nucleus centre."
2002-10-04,20:30,Southend,Essex,,"One white, very small object, very high up in the sky."
2002-10-17,02:54,Hull,East Yorkshire,Two Police Officers,"Appeared as the size of a 'normal' bright star, but of different colours - blue, green, red and white. The object moved fast."
2002-10-23,07:04,Woodbridge,Suffolk,,Large silver triangle which then changed shape. Was clouded in a pink and green haze.
2002-10-25,01:30,Liverpool,Merseyside,,"Object looked like an upturned saucer, with a dome on top. It had amber lights, and the dome had a light on top. Was hovering."
2002-11,14:30,Walcott,Lincolnshire,,"Dark, black torpedo shaped object. White plume of smoke."
2002-11-02,23:00,Gors-goch,Dyfed,,Round yellowish light followed by a green light. Went up vertically.
2002-11-02,22:58,Llanerchymedd,Gwynedd,,"One light, the size of a football moving slowly at about 2-3000ft."
2002-11-07,06:30,Wolverhampton,West Midlands,,"Two sets of lights, with an aircraft in the middle of them."
2002-11-09,22:00,Lechlade,Gloucestershire,,Series of lights moving in an arc. They were pink and spaced out.
2002-11-11,23:00,Nottingham,Nottinghamshire,,"Eight objects joined into a circle, then separated. Moved independently, then joined together again in a circle."
2002-11-14,22:12,Saddleworth Moor,Gtr Manchester,,"Small football size white light, with a blue tail."
2002-11-15,12:15,Eyam,Derbyshire,,"Large flying object, witness had never seen anything like it before. No lights whatsoever."
2002-11-15,21:30,Liverpool,Merseyside,,Series of eight to ten lights all tracing a pattern in the sky.
2002-11-24,20:00,Bohuntine,Highlands,,"Round orange shaped object, with pale green lights shining out in all directions. (A possible halo)."
2002-11-28,14:26,Cardiff Docks,South Glamorgan,,Two sightings over Cardiff docks. The objects were of different colours and were moving up and down.
2002-12-09,17:30,Bishop's Stortford,Hertfordshire,,"Small round, dull light seen."
2002-12-10,18:27,Stoke-on-Trent,Staffordshire,,Saw an orange disc shape.
2002-12-16,02:35,"M62, Near Rothwell",West Yorkshire,,"A number of objects - quite large, long, thin and shaped like cuttlefish. Joined to become a rectangular, vertical light, skimming along."
2002-12-18,16:40,Coningsby,,,"Bright oval shape cluster of lights, that grew brighter than the moon."
2002-12-19,06:30,Chaldon,Surrey,,"Very bright object, with an orange/yellow triangle behind it."
2002-12-19,06:30,Notting Hill,London,,"Very large object, falling like a shooting star. Flames were coming out of the back. (Could have been a satellite re-entering)."
2002-12-19,06:30,Brighton,East Sussex,,"Large cylindrical object, white flowing light from the front and flames coming from the rear. Some noise, not loud."
2002-12-19,06:30,Newton Abbott,Devon,,A strange object/light. No sound.
2002-12-24,10:39,Aylesbury,Buckinghamshire,,"Orange object, with a lighter coloured trail, about ten times the length of the head."
2002-12-28,20:10,"On A31, nr Hogsback",Surrey,,Four pairs of lights.
2002-12-29,00:00,7 miles past Lancaster,Lancashire,,On M6. Bright green light about the size of a traffic light arched over and came down to the ground and broke up.
,,Solihull,West Midlands,,Saw two bright lights. (Seen in 2002).
,,Welwyn Garden City,Hertfordshire,,"One disc shaped object, that was tangerine coloured. Zig-zagged for a while and then departed after fifteen seconds."
,,Television Studio,,,"A black tube appeared in the studio, two doors opened and then closed. It rose to the ceiling and then disappeared. Moved around."
2003-01-04,21:15,"St Clares, Nr Carmarthen",Dyfed,,"White object with vivid flashing green, blue and red lights."
2003-01-04,19:20,Nr Benbecula Airport,,Senior Air Traffic Control Officer,"One object with a very bright light like an aircraft's landing light, with a smaller dimmer light on top of the bright light."
2003-01-06,15:00,Huddersfield,West Yorkshire,,"Three silver or white balls in the sky, joined by another two. Quite large. Travelling in a line."
2003-01-07,21:26,Blackpool,Lancashire,,"One bright white object, hovering at first, then moving quickly."
2003-01-08,22:00,Coaltown of Balgonie,Fife,,"Changing shape. Strong blue, green and red lights pulsating lights. Jumbo Jet sized."
2003-01-10,03:00,Brighton,,,"Looked like a satellite re-entering, moving across the sky, then shot off like a shooting star."
2003-01-10,,Stirling,Scotland,,Two aircraft type objects flying next to each other. Both had vapour trails.
2003-01-10,01:00,East Dulwich,London,,"Lights, that were formed in a worm shape, wriggling around in the sky."
2003-01-11,23:45,Bridgnorth,Salop,,"Oblong in shape with three vertical flashing lights, red, yellow and green, all flashing at the same time."
2003-01-13,07:40,Dunkeld,Tayside,,"Distant object moving from side to side. Bright light, brighter than any star. Went dim from time to time."
2003-01-15,22:10,Cowbridge,South Glamorgan,,"A large round disc, slightly smaller than the moon. Creamy white then changed green."
2003-01-19,18:03,Stonehaven,Grampian,,Three bright lights forming a triangle. Hovering not moving.
2003-01-25,19:08,Chester,Cheshire,,Twelve bright lights moving from side to side.
2003-01-29,18:15,Wolverhampton,West Midlands,Sgt - RAF,"Two triangular shaped objects, flying in perfect syncronisation. Low humming noise - not like a normal commercial airliner."
2003-02-03,,Leyland,Lancashire,,"Bright light lit up the curtains, and for a split second appeared to be heading for the window. Followed by a loud bang."
2003-02-16,17:20,Birmingham,West Midlands,,Object seen. Static.
2003-02-19,18:30,Huntingdon,Cambridgeshire,,Like a shooting star falling to the ground.
2003-02-21,10:30,Penryn,Cornwall,,"A circular bright light - three arms on the object, (not rotating), in the middle of it was a red light."
2003-02-25,23:00,Southfields,London,,"Object, not a plane, not on flight path and not a star."
2003-03-01,,Northampton,Northamptonshire,,"Two large white objects, close together, looked like jets or refuelling planes. Going at jet speed."
2003-03-02,15:54,Pontypridd,Mid-Glamorgan,,"Strange object, silver and shaped like a dart."
2003-03-11,21:50,Wellingborough,Northamptonshire,,An object high up in the sky.
2003-03-30,20:00,Aldershot,Hampshire,,A very large delta shaped formation of steady red lights - no noise.
2003-03-30,,Glastonbury,Somerset,,Lights in the sky.
2003-03-31,09:20,,London,,Two silver objects that were stationary in the sky. One seemed to be closer than the other.
2003-04-05,03:58,,,,"Massive object, about the size of two football pitches, triangular shape. Took off very fast."
2003-04-07,02:30,Falmouth,Cornwall,,One craft with three yellow lights on portside and three red lights on starboard side. Shape was between circular and triangular or Delta wing size.
2003-04-11,22:21,Stansted Airport,Essex,Captain and First Officer of an aircraft,"A ball of fire, very bright, with no colour."
2003-04-23,18:15,Heathrow Airport,London,,"A ball of light, with no colour, passed under an aircraft, front to back, very fast."
2003-04-24,,Shepherds Bush,London,,Crafts coming down from behind the clouds.
2003-05-05,18:30,,,,"Saw a black triangle flying quite fast and silently, through the sky in a single direction."
2003-05-13,17:45,Belfast,Northern Ireland,,Two objects that looked like stars.
2003-05-25,23:00,Sandyford,Lanarkshire,,The object was high and bright and had no anti-collision lights.
2003-05-25,23:05,Kilmacolm,Strathclyde,,Large bright light.
2003-05-25,23:20,St. Leonards,East Kilbride,,Huge white ball that was glowing. (Looked like a flying jellyfish).
2003-05-28,07:50,Great Yarmouth,Norfolk,,The object was saucer shaped.
2003-05-30,23:25,Kingston-upon-Hull,Humberside,,A bright light in the sky.
2003-05-31,21:00,Gateshead,Tyne and Wear,,Black orb with five or six tassles underneath it.
2003-06-08,17:00,Wellingborough,Northamptonshire,,White cylindrical object moving very fast up into the sky.
2003-06-09,06:40,Isleworth,London,,"Silver object as bright as a star, changed from a cylinder to a crescent moon shape, with red and silver stripes."
2003-06-14,21:35,Llandrindod Wells,Powys,,Very big red light balls hovering. One red light hung smaller and then dropped out.
2003-06-14,15:39,Walthamstow,London,,"Cylinder shaped object, with radius around it of what looked like faint stars. Thought it was metal, as light was shining off of it."
2003-06-14,06:00,Girton,Cambridgeshire,,Small circular object. Blue and white translucent.
2003-06-20,08:35,Dunstable,Bedfordshire,,A string of two sets of two lights.
2003-06-21,16:43,Richmond,London,,"A doughnut shaped object was spotted moving from left to right, side to side. One side was shiny and reflective, and the other black."
2003-06-21,12:32,Wimbledon,London,,Just said something was seen for three seconds. (Didn't specify).
2003-06-26,16:28,Melksham,Wiltshire,,The object was a silvery white colour and non reflective in the sunshine.
2003-06-28,23:22,Glastonbury,Somerset,,Orange lights moving as a group in a circular motion. Moved slowly along.
2003-07-08,20:00,Hereford,Herefordshire,MOD Police,A stationary triangular object was seen. The object remained stationary for about 30 minutes at quite a height.
2003-07-12,22:05,Rhonda,Mid-Glamorgan,,"Two round objects with legs, which were black and spinning."
2003-07-13,,Wellingborough,Northamptonshire,,Saw a ball of light in the sky.
2003-07-13,20:30,Winterley,Cheshire,,"Appeared like a star, possibly a balloon."
2003-07-14,21:30,,Northamptonshire,,Saw the biggest white light that the witness had ever seen before. It shot off across the sky and then disappeared.
2003-07-15,03:25,Bermondsey,London,,Assumed object to be a shooting star at first. No trail behind.
2003-07-15,21:40,Galston on Sea,Norfolk,,"Disc like object, moving in the sky slowly, poised once and headed in a NE direction."
2003-07-15,00:30,Malvern,Worcestershire,,One light was seen. Erratic movement and stationary.
2003-07-20,23:05,Bridlington,East Yorkshire,,"Bright white star like light. Moved from side to side, up and down and in circles."
2003-07-22,,Bridlington,East Yorkshire,,Silver or white object. Moved at an unbelievable speed.
2003-07-27,18:00,Gravesend,Kent,,Silver ball up in the sky for about an hour. Disappeared and then returned again about an hour later.
2003-08-04,21:00,Wellingborough,Northamptonshire,,A brilliant orange ball of light seen 2000ft up in the sky.
2003-08-08,22:35,West Kilbride,Ayrshire,,"A star shaped object. Witness watched for a few minutes, then it dropped from the sky like a bomb."
2003-08-10,23:15,West Kilbride,Ayrshire,,Could see a few round spheres.
2003-08-13,22:55,Maesteg,Mid-Glamorgan,,"Roundish, football shaped. Flashing lights-multi coloured. The lights were on top, then moved around the object."
2003-08-14,18:00,Southfleet,Kent,,"Unusual object, with flashing lights but not like an aircrafts, more like reflections from the sun. No trail."
2003-08-14,23:09,Newport,Gwent,,Orange circular object seen. Stayed stationary.
2003-08-16,21:00,Amesbury,Wiltshire,,Flying saucer shaped object.
2003-08-17,23:45,Bonnybridge,Central,,Just said a sighting.
2003-08-19,23:30,St Seithins,Perthshire,,"Object with two white lights and one red and one orange in the middle, both flashing."
2003-08-21,14:00,Lincoln,Lincolnshire,,"The object was cigar shaped, grey in colour with domed ends, was silent and very slow."
2003-08-27,23:00,Worcester,Worcestershire,,"A helium type balloon, size of a moon, with flashing blue and red lights, moving north along the line of the A38 over the area south of Worcester."
2003-09-03,21:35,Wellingborough,Northamptonshire,,An orange ball seen about 2000ft up in the sky.
2003-09-04,23:40,Todmorden,West Yorkshire,,"There were six lights that split, at one point becoming eight lights, that were orange and red in colour."
2003-09-13,21:40,Heckmondwike,West Yorkshire,Senior Curator/Royal Armouries Museum,"Two circular objects, about half the apparent size of the moon, that were a very dull yellow."
2003-09-13,22:40,Manchester,Gtr Manchester,,"Round, white lights in the sky."
2003-09-13,20:15,Great Yarmouth,Norfolk,,Bright as Mars. White light. Dim brightness. Moved in a South East direction.
2003-09-17,20:45,Northampton,Northants,,"Two small, star size objects, much darker orange or rust colour, followed by another two, doing manoeuvres."
2003-09-17,21:00,Northolt,London,,"One object. White brilliant light, flickering yellow and red. Extremely brighter than other stars around it. Moving from side to side."
2003-09-18,03:00,Wimbledon,London,,"Triangular object, copper coloured. Hovered over the house for about a minute then disappeared."
2003-09-19,22:30,Ashby De La Launde,"Nr Digby, Lincolnshire",,"The object was spinning whilst stationary, while above a house."
2003-09-22,,Hove,East Sussex,,"A red unidentified flying object, definitely not an aeroplane."
2003-09-24,19:25,Barry,South Glamorgan,,"Saw an unusual object, falling from a cloud, like it was burning, and was very fast. Was viewed for five minutes."
2003-09-24,20:45,Northampton,Northamptonshire,,"Saw two pairs of objects, that were not recognisable as aircraft and were purple in colour."
2003-10-14,06:56,Whitney,Oxfordshire,,"Very large object, lights were flashing on it."
2003-10-26,21:06,North Wirral,Merseyside,,"There were two objects travelling side by side overhead, and were a dull red colour."
2003-11-05,16:30,Southbound on the A11,,Assistant Secretary/RAF Dependants Fund,Two bright lights in the sky.
2003-11-17,02:25,Bromley,Kent,Police Officers/Police helicopter crew,There were 20-30 red flashing lights in the sky accompanied by a whirring noise.
2003-11-25,14:25,Wem,Shropshire,,A strange bright orange/red light in the sky.
2003-12-01,,Woodbridge,Suffolk,,"Looked like an unusual aircraft, but with strange lights."
2003-12-02,01:20,Aylesbury,Buckinghamshire,,"Nothing was seen, but a loud noise was heard, like a balloon letting out air."
2003-12-02,01:30,Thame,Oxfordshire,Editor of a newspaper,"A loud noise like a hot air balloon was heard, but nothing was seen."
2003-12-17,19:15,Wokingham,Berkshire,,The object was black/dark with lights along the side and a weird strobe light. Was about 60 ft across. Very high in the sky.
2003-12-29,01:50,Nr Barnton Park,Edinburgh,,A steady bright light in the sky resembling the front of a helicopter.
,,Ashburton,Devon,,(Seen for six weeks - Feb/March 2003). Two strange lights in the sky.
,,Wellingborough,Northamptonshire,,"(Seen for three weeks in Feb 2003). Very bright white light with about five other lights around it, that were moving. Looked like a barrage balloon from World War 2."
,,Wigan,Lancashire,,"(Seen 2003). 17 spaceships. V shaped, oblong, wings and different colours. Could see green aliens with cream coloured bellies."
2003-08-14,23:09,Newport,Gwent,,Orange circular object seen. Stayed stationary.
2003-08-16,21:00,Amesbury,Wiltshire,,Flying saucer shaped object.
2003-08-17,23:45,Bonnybridge,Central,,Just said a sighting.
2003-08-19,23:30,St Seithins,Perthshire,,"Object with two white lights and one red and one orange in the middle, both flashing."
2003-08-21,14:00,Lincoln,Lincolnshire,,"The object was cigar shaped, grey in colour with domed ends, was silent and very slow."
2003-08-27,23:00,Worcester,Worcestershire,,"A helium type balloon, size of a moon, with flashing blue and red lights, moving north along the line of the A38 over the area south of Worcester."
2003-09-03,21:35,Wellingborough,Northamptonshire,,An orange ball seen about 2000ft up in the sky.
2003-09-04,23:40,Todmorden,West Yorkshire,,"There were six lights that split, at one point becoming eight lights, that were orange and red in colour."
2003-09-13,21:40,Heckmondwike,West Yorkshire,Senior Curator/Royal Armouries Museum,"Two circular objects, about half the apparent size of the moon, that were a very dull yellow."
2003-09-13,22:40,Manchester,Gtr Manchester,,"Round, white lights in the sky."
2003-09-13,20:15,Great Yarmouth,Norfolk,,Bright as Mars. White light. Dim brightness. Moved in a South East direction.
2003-09-17,20:45,Northampton,Northants,,"Two small, star size objects, much darker orange or rust colour, followed by another two, doing manoeuvres."
2003-09-17,21:00,Northolt,London,,"One object. White brilliant light, flickering yellow and red. Extremely brighter than other stars around it. Moving from side to side."
2003-09-18,03:00,Wimbledon,London,,"Triangular object, copper coloured. Hovered over the house for about a minute then disappeared."
2003-09-19,22:30,Ashby De La Launde,"Nr Digby, Lincolnshire",,"The object was spinning whilst stationary, while above a house."
2003-09-22,,Hove,East Sussex,,"A red unidentified flying object, definitely not an aeroplane."
2003-09-24,19:25,Barry,South Glamorgan,,"Saw an unusual object, falling from a cloud, like it was burning, and was very fast. Was viewed for five minutes."
2003-09-24,20:45,Northampton,Northamptonshire,,"Saw two pairs of objects, that were not recognisable as aircraft and were purple in colour."
2003-10-14,06:56,Whitney,Oxfordshire,,"Very large object, lights were flashing on it."
2003-10-26,21:06,North Wirral,Merseyside,,"There were two objects travelling side by side overhead, and were a dull red colour."
2003-11-05,16:30,Southbound on the A11,,Assistant Secretary/RAF Dependants Fund,Two bright lights in the sky.
2003-11-17,02:25,Bromley,Kent,Police Officers/Police helicopter crew,There were 20-30 red flashing lights in the sky accompanied by a whirring noise.
